id,name,image,description,type,damage negation,resistance,weight,special effect,how to acquire,in-game section,dlc
0,Dane's Hat,http://eldenring.wiki.fextralife.com/file/Elden-Ring/danes_hat_helm_elden_ring_shadow_of_the_erdtree_dlc_wiki_guide_200px.png,"The sun-faded and lightly soiled hat of Dryleaf Dane. Worn low over the eyes, it obscures the wearer's vision. Meeting the gaze of another can overcome the senses, often leading to the downfall of those who would walk the noble and solitary seekers' path.",helm,"[{'Phy': '1.8', 'VS Str.': '2.3', 'VS Sla.': '1.4', 'VS Pie.': '1.4', 'Mag': '5.0', 'Fir': '4.2', 'Lit': '4.5', 'Hol': '5.0'}]","[{'Imm.': '16', 'Rob.': '11', 'Foc.': '33', 'Vit.': '31', 'Poi.': '3'}]",2.2,,This Helm is obtained as a drop upon defeating Dryleaf Dane. [Elden Ring Shadow of the Erdtree Interactive Map],6,1
1,Gaius's Helm,http://eldenring.wiki.fextralife.com/file/Elden-Ring/gaiuss_helm_helm_elden_ring_shadow_of_the_erdtree_dlc_wiki_guide_200px.png,The black iron helm of Commander Gaius. Part of an armor set patterned after fallen seeds. Gaius was the most senior disciple of the same Alabaster Lord who taught Radahn and Gaea gravitational technique.,helm,"[{'Phy': '6.1', 'VS Str.': '5.6', 'VS Sla.': '7.2', 'VS Pie.': '7.0', 'Mag': '5.0', 'Fir': '4.9', 'Lit': '4.9', 'Hol': '4.9'}]","[{'Imm.': '29', 'Rob.': '35', 'Foc.': '23', 'Vit.': '23', 'Poi.': '12'}]",8.6,,"Purchased from the Enia at the Roundtable Hold, after defeating Commander Gaius.",12,1
2,Oathseeker Knight Helm,http://eldenring.wiki.fextralife.com/file/Elden-Ring/oathseeker_knight_helm_helm_elden_ring_shadow_of_the_erdtree_dlc_wiki_guide_200px.png,"An Oathseeker Knight helm. Black with gold ornamentation. These knights set off on quests of discovery, hoping to find by themselves an oath of their own choosing to serve in perfect, lifelong devotion.",helm,"[{'Phy': '4.4', 'VS Str.': '3.8', 'VS Sla.': '4.2', 'VS Pie.': '4.0', 'Mag': '3.6', 'Fir': '3.4', 'Lit': '2.3', 'Hol': '3.4'}]","[{'Imm.': '12', 'Rob.': '21', 'Foc.': '10', 'Vit.': '9', 'Poi.': '7'}]",4.4,,"Found inside a hanging body, just outside the Church of Benediction. It contains the whole set: Oathseeker Knight Greaves, Oathseeker Knight Gauntlets, Oathseeker Knight Armor, and Oathseeker Knight Helm. It also contains Pata weapon. [See Shadow of the Erdtree Map]",2,1
3,Verdigris Helm,http://eldenring.wiki.fextralife.com/file/Elden-Ring/verdigris_helm_helm_elden_ring_shadow_of_the_erdtree_dlc_wiki_guide_200px.png,Helm made from an unusual metal known as verdigris. Verdigris is said to be the gift of an outer god. Possessed of an enormously hefty yet supple strength thanks to its rusted nature.,helm,"[{'Phy': '7.5', 'VS Str.': '6.4', 'VS Sla.': '7.2', 'VS Pie.': '6.8', 'Mag': '4.8', 'Fir': '4.7', 'Lit': '5.2', 'Hol': '4.7'}]","[{'Imm.': '39', 'Rob.': '46', 'Foc.': '15', 'Vit.': '22', 'Poi.': '15'}]",11.1,,Complete Moore's questline,19,1
4,Pelt of Ralva,http://eldenring.wiki.fextralife.com/file/Elden-Ring/pelt_of_ralva_helm_elden_ring_shadow_of_the_erdtree_dlc_wiki_guide_200px.png,"The pelt of Ralva the Great Red Bear, worn upon the head without modification. Enhances incantations of what is jokingly called ""Bear Communion."" This untreated hide, won at the end of a bloody bout, is just the thing to make a wild bear out of a warrior.",helm,"[{'Phy': '3.1', 'VS Str.': '3.4', 'VS Sla.': '3.1', 'VS Pie.': '3.1', 'Mag': '4.2', 'Fir': '4.0', 'Lit': '4.5', 'Hol': '4.0'}]","[{'Imm.': '27', 'Rob.': '23', 'Foc.': '22', 'Vit.': '22', 'Poi.': '5'}]",3.6,"Enhances incantations of ""Bear Communion"" by 15%.","This is a helmet type of armor that can be obtained after defeating Ralva the Great Red Bear. It is known to enhance incantations of what is jokingly called ""Bear Communion."" [See Shadow of the Erdtree Map]",6,1
5,Fang Helm,http://eldenring.wiki.fextralife.com/file/Elden-Ring/fang_helm_helm_elden_ring_shadow_of_the_erdtree_dlc_wiki_guide_200px.png,"Helm of Red Bear, whose name is lost to madness. The cheek guards are shaped after lion fangs. Perhaps his fascination with the untamed strength of the wild stemmed from his past as a Redmane.",helm,"[{'Phy': '2.3', 'VS Str.': '2.5', 'VS Sla.': '2.3', 'VS Pie.': '2.3', 'Mag': '3.6', 'Fir': '3.4', 'Lit': '4.0', 'Hol': '3.4'}]","[{'Imm.': '23', 'Rob.': '18', 'Foc.': '16', 'Vit.': '16', 'Poi.': '4'}]",2.7,,Armor piece drops upon defeating the Red Bear located at the Northern Nameless Mausoleum. [See Shadow of the Erdtree Map],4,1
6,Thiollier's Mask,http://eldenring.wiki.fextralife.com/file/Elden-Ring/thiolliers_mask_helm_elden_ring_shadow_of_the_erdtree_dlc_wiki_guide_200px.png,"A mask upon which is carved a tranquil sleeping face. The silver hair is arranged in the same style as St. Trina's, increasing arcane. Just once, Thiollier was granted the sweet repose of velvety sleep. The remainder of his days would be spent attempting to recapture it.",helm,"[{'Phy': '4.4', 'VS Str.': '3.4', 'VS Sla.': '4.0', 'VS Pie.': '3.8', 'Mag': '2.3', 'Fir': '3.1', 'Lit': '2.3', 'Hol': '3.1'}]","[{'Imm.': '15', 'Rob.': '16', 'Foc.': '11', 'Vit.': '0', 'Poi.': '6'}]",3.8,Increases Arcane +3,"Summon Thiollier during the battle at the end of his questline, then loot his body in the boss arena after the fight",19,1
7,High Priest Hat,http://eldenring.wiki.fextralife.com/file/Elden-Ring/high_priest_hat_helm_elden_ring_shadow_of_the_erdtree_dlc_wiki_guide_200px.png,"The hat of Count Ymir, High Priest. The circular design at the top represents the Greater Will and its lightless abyss, imparting increased intelligence and arcane to the wearer. Though Count Ymir instructed Rellana in the sorcerous arts, he abandoned his allegiance to the moon. ""It was merely the closest of the celestial bodies. Nothing more.""",helm,"[{'Phy': '1.8', 'VS Str.': '2.1', 'VS Sla.': '1.4', 'VS Pie.': '0.9', 'Mag': '4.6', 'Fir': '4.5', 'Lit': '4.4', 'Hol': '4.5'}]","[{'Imm.': '18', 'Rob.': '10', 'Foc.': '27', 'Vit.': '33', 'Poi.': '3'}]",1.7,Increases Intelligence +1 and Arcane +1,"Dropped by Count Ymir, Mother of Fingers, who can be found in the Cathedral of Manus Metyr after interacting with the throne, you can only find Count Ymir there after you have defeated Metyr, Mother of Fingers. [Elden Ring Shadow of the Erdtree Map]",6,1
8,Caterpillar Mask,http://eldenring.wiki.fextralife.com/file/Elden-Ring/caterpillar_mask_helm_elden_ring_shadow_of_the_erdtree_dlc_wiki_guide_200px.png,"Grotesque mask constructed from countless solidified caterpillars. A ritual implement of the greater potentates of Bonny Village. Used to ward off thoughts of impurity, doubt, temptation, and other wickednesses one is vulnerable to while absorbed in divine ritual.",helm,"[{'Phy': '1.8', 'VS Str.': '1.4', 'VS Sla.': '1.4', 'VS Pie.': '0.9', 'Mag': '4.5', 'Fir': '3.8', 'Lit': '4.2', 'Hol': '4.6'}]","[{'Imm.': '16', 'Rob.': '9', 'Foc.': '45', 'Vit.': '25', 'Poi.': '2'}]",1.4,,Complete Hornsent quest.,19,1
9,Dancer's Hood,http://eldenring.wiki.fextralife.com/file/Elden-Ring/dancers_hood_helm_elden_ring_shadow_of_the_erdtree_dlc_wiki_guide_200px.png,"Bright-red hood of the Ranah dancers. Enhances the power of dancing attacks. The dance of Ranah is one of burning passion, and the most passionate dancers never allow their fiery dance to end, losing even their names as they dance on. To see the passion fade is to see the dancer's flame extinguished.",helm,"[{'Phy': '0.9', 'VS Str.': '0.2', 'VS Sla.': '1.8', 'VS Pie.': '0.2', 'Mag': '4.4', 'Fir': '4.4', 'Lit': '4.0', 'Hol': '4.2'}]","[{'Imm.': '15', 'Rob.': '10', 'Foc.': '24', 'Vit.': '26', 'Poi.': '1'}]",1.0,Enhances the power of dancing attacks by 2.5%.,Dropped by defeating Dancer of Ranah at the Southern Nameless Mausoleum [Elden Ring Shadow of the Erdtree Interactive Map],9,1
10,Helm of Night,http://eldenring.wiki.fextralife.com/file/Elden-Ring/helm_of_night_helm_elden_ring_shadow_of_the_erdtree_dlc_wiki_guide_200px.png,"Bottomless black helm, cool to the touch.Flowing lines in the seeming shape of a fingerprint adorn the surface. Imprisons the wearer in utterly lightless dark.Bestowed upon those born deep underground, ordaining them as Swordhands of Night.",helm,"[{'Phy': '2.5', 'VS Str.': '2.5', 'VS Sla.': '2.8', 'VS Pie.': '2.8', 'Mag': '4.4', 'Fir': '3.4', 'Lit': '3.4', 'Hol': '4.5'}]","[{'Imm.': '23', 'Rob.': '14', 'Foc.': '20', 'Vit.': '20', 'Poi.': '4'}]",3.0,,"Bonny Gaol: Use the jar lift near the bridge twice to reach the top level of the gaol. First, hop on the jar, go to the bridge level, and activate the switch. Ride the jar lift for the second time to go to the top level. You can find the Night Set on a corpse laying on top of a table. [See SOTE Elden Ring DLC Map] [Video Link]",6,1
11,Igon's Helm,http://eldenring.wiki.fextralife.com/file/Elden-Ring/igons_helm_helm_elden_ring_shadow_of_the_erdtree_dlc_wiki_guide_200px.png,"Helm of the broken drake warrior Igon, from a set of armor comprised of a miscellany of parts. This tattered protective-wear is shaped like a bugle. The poor scavenger of battlefields found honor through Dragon Communion.",helm,"[{'Phy': '3.1', 'VS Str.': '3.4', 'VS Sla.': '3.1', 'VS Pie.': '3.1', 'Mag': '3.6', 'Fir': '3.8', 'Lit': '4.0', 'Hol': '3.6'}]","[{'Imm.': '26', 'Rob.': '16', 'Foc.': '22', 'Vit.': '22', 'Poi.': '5'}]",3.3,,Loot Igon after defeating Bayle the Dread.,14,1
12,Igon's Helm (Altered),http://eldenring.wiki.fextralife.com/file/Elden-Ring/igons_helm_(altered)_helm_elden_ring_shadow_of_the_erdtree_dlc_wiki_guide_200px.png,"Helm of the broken drake warrior Igon, from a set of armor comprised of a miscellany of parts. Patched with scraps of cloth. The poor scavenger of battlefields found honor through Dragon Communion.",helm,"[{'Phy': '2.8', 'VS Str.': '3.1', 'VS Sla.': '2.8', 'VS Pie.': '2.8', 'Mag': '3.4', 'Fir': '3.6', 'Lit': '3.8', 'Hol': '3.4'}]","[{'Imm.': '24', 'Rob.': '15', 'Foc.': '20', 'Vit.': '20', 'Poi.': '5'}]",3.0,,Alter Igon's Helm at any Site of Grace,14,1
13,Wise Man's Mask,http://eldenring.wiki.fextralife.com/file/Elden-Ring/wise_mans_mask_helm_elden_ring_shadow_of_the_erdtree_dlc_wiki_guide_200px.png,"The iron mask of Sir Ansbach, giving the appearance of a quiet, wise, old bearded man. But an old fear lurks beneath, together with the cold, unflinching discipline that once honed his blade, now employed to enhance Blood Oath and dynastic skills.",helm,"[{'Phy': '4.2', 'VS Str.': '3.6', 'VS Sla.': '4.4', 'VS Pie.': '4.0', 'Mag': '3.1', 'Fir': '4.0', 'Lit': '2.3', 'Hol': '3.1'}]","[{'Imm.': '11', 'Rob.': '24', 'Foc.': '9', 'Vit.': '10', 'Poi.': '7'}]",4.0,Enhances Blood Oath and dynastic skills by 5%.,"Complete Sir Ansbach's questline all the way through the end, and side with him when facing Leda, and then Promised Consort Radahn/ Radahn, Consort of Miquella. After the fight is over, Sir Ansbach's body will be near the site of grace, alongside with his equipment and his Incantation. [Map Link]",19,1
14,Freyja's Helm,http://eldenring.wiki.fextralife.com/file/Elden-Ring/freyjas_helm_helm_elden_ring_shadow_of_the_erdtree_dlc_wiki_guide_200px.png,"Golden helm of Redmane Freyja, member of General Radahn's most distinguished knights. A hideous scarlet wound was once hewn into the center of her face. Later, Miquella gently put his lips to it and the unfading scar became the compass that Freyja would thereafter follow.",helm,"[{'Phy': '5.5', 'VS Str.': '4.2', 'VS Sla.': '4.8', 'VS Pie.': '4.8', 'Mag': '4.0', 'Fir': '4.2', 'Lit': '3.8', 'Hol': '4.2'}]","[{'Imm.': '13', 'Rob.': '28', 'Foc.': '9', 'Vit.': '12', 'Poi.': '8'}]",5.8,,Drop by Redmane Freyja.,19,1
15,Helm of Solitude,http://eldenring.wiki.fextralife.com/file/Elden-Ring/helm_of_solitude_helm_elden_ring_shadow_of_the_erdtree_dlc_wiki_guide_200px.png,"Steel helm of the Knights of the Solitary Gaol. Part of a heavy armor set that covers the whole body in overlapping plates of steel. The nameless mausoleums of the realm of shadow are said to hold the spirits of warriors who lost their names, or their hearts.",helm,"[{'Phy': '6.8', 'VS Str.': '6.4', 'VS Sla.': '6.7', 'VS Pie.': '6.3', 'Mag': '4.7', 'Fir': '5.2', 'Lit': '4.8', 'Hol': '4.9'}]","[{'Imm.': '26', 'Rob.': '27', 'Foc.': '42', 'Vit.': '22', 'Poi.': '14'}]",10.3,,Can be obtained after defeating the Blackgaol Knight found inside Northern Nameless Mausoleum. [See Shadow of the Erdtree Map],1,1
16,Messmer Soldier Helm,http://eldenring.wiki.fextralife.com/file/Elden-Ring/messmer_soldier_helm_helm_elden_ring_shadow_of_the_erdtree_dlc_wiki_guide_200px.png,"Helm worn by soldiers who serve Messmer the Impaler. The iron helm features a visor. Though the engraving upon the forehead is a Scadutree design, it is etched in gold. A small consolation to those forced to wage a war without grace or honor.",helm,"[{'Phy': '4.4', 'VS Str.': '3.6', 'VS Sla.': '4.4', 'VS Pie.': '4.2', 'Mag': '3.1', 'Fir': '3.6', 'Lit': '2.5', 'Hol': '3.1'}]","[{'Imm.': '12', 'Rob.': '22', 'Foc.': '9', 'Vit.': '9', 'Poi.': '7'}]",4.0,,Drop from Messmer Soldiers,17,1
17,Black Knight Helm,http://eldenring.wiki.fextralife.com/file/Elden-Ring/black_knight_helm_helm_elden_ring_shadow_of_the_erdtree_dlc_wiki_guide_200px.png,"Helm worn by the Black Knights, servants of Messmer the Impaler. Black iron ornamented with gold. A rotten odor stubbornly clings to it. Perhaps it arises from the tainted nature of the blood that splattered upon it. Or perhaps it is the wearer's own blackened soul, festering after endless slaughter.",helm,"[{'Phy': '5.2', 'VS Str.': '4.4', 'VS Sla.': '5.2', 'VS Pie.': '5.8', 'Mag': '4.4', 'Fir': '4.6', 'Lit': '3.8', 'Hol': '4.0'}]","[{'Imm.': '16', 'Rob.': '26', 'Foc.': '10', 'Vit.': '9', 'Poi.': '9'}]",5.9,,"Black Knight Set pieces are dropped from Black Knights, found throughout the Lands of Shadow.",17,1
18,Rakshasa Helm,http://eldenring.wiki.fextralife.com/file/Elden-Ring/rakshasa_helm_helm_elden_ring_shadow_of_the_erdtree_dlc_wiki_guide_200px.png,"Helm of Rakshasa, soaked in the spurting blood of her victims. Tatters of ragged cloth jut out haphazardly, as if her lust for carnage threatens to break free.Increases damage dealt to foes, but greatly increases damage taken by the wearer.Cut down and devour. Only those who repeat the cycle without rest can truly subvert the self and become Rakshasa.",helm,"[{'Phy': '2.7', 'VS Str.': '2.3', 'VS Sla.': '3.1', 'VS Pie.': '2.9', 'Mag': '2.1', 'Fir': '2.5', 'Lit': '1.9', 'Hol': '2.1'}]","[{'Imm.': '15', 'Rob.': '26', 'Foc.': '12', 'Vit.': '12', 'Poi.': '9'}]",5.5,Boosts All Damage by 2%,Dropped by Rakshasa in Eastern Nameless Mausoleum. This area can only be accessed by using the ladder in Shadow Keep to get down to a special teleport coffin (this Elden Ring Map location). This will take you to Ruins of Unte and you must follow the cliffs downstream and then carefully drop down to bottom level to reach the mausoleum. [Shadow of the Erdtree Map],6,1
19,Fire Knight Helm,http://eldenring.wiki.fextralife.com/file/Elden-Ring/fire_knight_helm_helm_elden_ring_shadow_of_the_erdtree_dlc_wiki_guide_200px.png,"Pointed helm of the Fire Knights under Messmer the Impaler's personal command. Slightly increases maximum HP, stamina, and maximum equip load. Each and every knight hailed from a renowned family of the Erdtree's upper echelons, but were shunned and chased from their homes after pledging allegiance to Messmer as their master.",helm,"[{'Phy': '4.6', 'VS Str.': '3.6', 'VS Sla.': '4.2', 'VS Pie.': '3.8', 'Mag': '3.4', 'Fir': '4.2', 'Lit': '2.5', 'Hol': '3.1'}]","[{'Imm.': '12', 'Rob.': '20', 'Foc.': '9', 'Vit.': '10', 'Poi.': '6'}]",4.0,"Slightly increases maximum HP by 2%, Stamina by 5%, and Equip Load by 4%.",Drop by Fire Knights in the Shadow Keep,17,1
20,Death Mask Helm,http://eldenring.wiki.fextralife.com/file/Elden-Ring/death_mask_helm_helm_elden_ring_shadow_of_the_erdtree_dlc_wiki_guide_200px.png,"Helm of Wego, elder among the Fire Knights. Two warped death masks stacked one atop the other. Reduces FP used to summon spirits. Gnawed at by loneliness, the old man turned his attention to the spirituality of Messmer's flame, using it in a rite of resurrection. Yet the soulless bodies he brought to life were no comfort to poor Wego.",helm,"[{'Phy': '4.3', 'VS Str.': '3.3', 'VS Sla.': '3.9', 'VS Pie.': '3.5', 'Mag': '3.0', 'Fir': '3.9', 'Lit': '2.2', 'Hol': '2.7'}]","[{'Imm.': '10', 'Rob.': '16', 'Foc.': '7', 'Vit.': '9', 'Poi.': '6'}]",3.4,Reduces FP to summon spirits by 12%,"Drops from a Fire Knight miniboss in the cathedral area of Shadow Keep, after draining out the water.",17,1
21,Winged Serpent Helm,http://eldenring.wiki.fextralife.com/file/Elden-Ring/winged_serpent_helm_helm_elden_ring_shadow_of_the_erdtree_dlc_wiki_guide_200px.png,"Helm of Kood, captain of the Fire Knights. A winged serpent perches atop it. Enhances Fire Knight skills. The winged serpent is the token creature of Messmer's military forces. It is a wise friend which keeps the base serpent at bay and holds its power in check.",helm,"[{'Phy': '4.8', 'VS Str.': '4.0', 'VS Sla.': '4.4', 'VS Pie.': '4.0', 'Mag': '3.8', 'Fir': '4.4', 'Lit': '2.8', 'Hol': '3.4'}]","[{'Imm.': '14', 'Rob.': '22', 'Foc.': '10', 'Vit.': '11', 'Poi.': '7'}]",4.6,Enhances Fire Knight skills by 10%.,"Shadow Keep: Sixth Floor: Climb the statues once you've used the lever to move them. Head outside, turn right and head up the stairs, turn left to find a Fire Knight at the end of the bridge. Drops this item and Ash of War: Flame Spear. [See Shadow of the Erdtree Map]",17,1
22,Salza's Hood,http://eldenring.wiki.fextralife.com/file/Elden-Ring/salzas_hood_helm_elden_ring_shadow_of_the_erdtree_dlc_wiki_guide_200px.png,"Hood of Salza, sage of the Fire Knights.A prodigious amount of cloth wound around it, giving the impression of a greatly swollen head, and wearing it increases intelligence.A disciple of the elder Wego, he refused to burn down an old ruin, at the risk of his own life.",helm,"[{'Phy': '4.4', 'VS Str.': '3.6', 'VS Sla.': '4.4', 'VS Pie.': '3.8', 'Mag': '3.1', 'Fir': '4.0', 'Lit': '2.8', 'Hol': '3.1'}]","[{'Imm.': '12', 'Rob.': '20', 'Foc.': '9', 'Vit.': '10', 'Poi.': '6'}]",3.8,Increases Intelligence +2,"From the West Rampart Site of Grace, take the bridge all the way. Use Torrent to avoid being trappped in the Rain of Fire. Defeat the Fire Knight at the end to obtain this and Rain of Fire. [See Shadow of the Erdtree Map]",18,1
23,Leather Headband,http://eldenring.wiki.fextralife.com/file/Elden-Ring/leather_headband_helm_elden_ring_shadow_of_the_erdtree_dlc_wiki_guide_200px.png,"Headband worn by highland warriors, made of woven leather. The white favor represents their home settlement. Highland warriors are known to be hunters of bears; to them, there is no act more glorious than the subjugation of a savage beast.",helm,"[{'Phy': '1.4', 'VS Str.': '2.1', 'VS Sla.': '1.8', 'VS Pie.': '1.4', 'Mag': '1.8', 'Fir': '2.3', 'Lit': '2.8', 'Hol': '2.3'}]","[{'Imm.': '16', 'Rob.': '10', 'Foc.': '12', 'Vit.': '11', 'Poi.': '2'}]",1.0,,"To the northwest of the Ravine North Site of Grace, there is a forest inhabited by runebears. At the center of this forest, you'll find a large stone with several items on it, this whole armor set is at the top of the stone. [See Shadow of the Erdtree Map]",7,1
24,Leather Crown,http://eldenring.wiki.fextralife.com/file/Elden-Ring/leather_crown_helm_elden_ring_shadow_of_the_erdtree_dlc_wiki_guide_200px.png,"Helm worn by highland warriors, pieced together using leather. The white favor represents their home settlement. Highland warriors are known to be hunters of bears; to them, there is no act more glorious than the subjugation of a savage beast.",helm,"[{'Phy': '3.1', 'VS Str.': '3.6', 'VS Sla.': '3.4', 'VS Pie.': '3.1', 'Mag': '3.4', 'Fir': '3.8', 'Lit': '4.2', 'Hol': '3.8'}]","[{'Imm.': '26', 'Rob.': '15', 'Foc.': '22', 'Vit.': '20', 'Poi.': '5'}]",3.3,,"Found laying on the grounds in the middle of the woods, alongside the rest of the Highland Warrior Set. [Map Link]",6,1
25,Death Knight Helm,http://eldenring.wiki.fextralife.com/file/Elden-Ring/death_knight_helm_helm_elden_ring_shadow_of_the_erdtree_dlc_wiki_guide_200px.png,"Golden helm of the Death Knights, whose own death masks served as the visards of their armor. Enhances skills and incantations of the capital's ancient dragon cult. The decayed golden wheel that adorns it represents their unbroken loyalty to Godwyn, he who became Prince of Death.",helm,"[{'Phy': '4.4', 'VS Str.': '3.8', 'VS Sla.': '4.4', 'VS Pie.': '4.4', 'Mag': '3.4', 'Fir': '3.4', 'Lit': '4.4', 'Hol': '2.8'}]","[{'Imm.': '12', 'Rob.': '20', 'Foc.': '8', 'Vit.': '20', 'Poi.': '7'}]",4.6,Enhances skills and incantations of the ancient dragon cult by 2%.,"Darklight Catacombs, on a Death Knight corpse",15,1
26,Curseblade Mask,http://eldenring.wiki.fextralife.com/file/Elden-Ring/curseblade_mask_helm_elden_ring_shadow_of_the_erdtree_dlc_wiki_guide_200px.png,"A mask affixed with a crown of tangled horns, worn by those who would invoke divinity. Divine invocation heightens the dexterity of the wearer, but causes the blessing of the Erdtree to become nauseating, reducing the restorative effect of drinking from a flask of sacred tears. Focus is also troubled by wearing this mask.",helm,"[{'Phy': '2.5', 'VS Str.': '0.9', 'VS Sla.': '2.3', 'VS Pie.': '2.1', 'Mag': '4.6', 'Fir': '4.6', 'Lit': '4.6', 'Hol': '4.9'}]","[{'Imm.': '22', 'Rob.': '11', 'Foc.': '0', 'Vit.': '33', 'Poi.': '4'}]",2.2,"Increases Dexterity by +5, but reduces the flask value by -7%",Drop by Curseblade enemies.,1,1
27,Messmer's Helm,http://eldenring.wiki.fextralife.com/file/Elden-Ring/messmers_helm_helm_elden_ring_shadow_of_the_erdtree_dlc_wiki_guide_200px.png,"Black helm of Messmer the Impaler, crowned with two intertwined winged serpents.Slightly enhances incantations of Messmer's flame as well as Fire Knight skills.The winged snakes were Messmer's constant companions.They were there when the base serpent was sealed away behind his eye. They were there through his eternity of suffering. They will accompany him yet, in his hideous new form born when he destroyed the grace granted by his mother. They have accepted his fate as much as he.",helm,"[{'Phy': '3.4', 'VS Str.': '3.4', 'VS Sla.': '3.1', 'VS Pie.': '3.8', 'Mag': '3.6', 'Fir': '4.4', 'Lit': '4.2', 'Hol': '3.6'}]","[{'Imm.': '26', 'Rob.': '18', 'Foc.': '24', 'Vit.': '26', 'Poi.': '5'}]",3.6,Slightly enhances incantations of Messmer's fire and Fire Knight skills by 3%.,Purchase from Finger Reader Enia at Roundtable Hold after defeating Messmer the Impaler,17,1
28,Messmer's Helm (Altered),http://eldenring.wiki.fextralife.com/file/Elden-Ring/messmers_helm_(altered)_helm_elden_ring_shadow_of_the_erdtree_dlc_wiki_guide_200px.png,"Black helm of Messmer the Impaler, crowned with two intertwined winged serpents. Slightly enhances incantations of Messmer's fire as well as Fire Knight skills.The winged snakes were Messmer's constant companions.They were there when the base serpent was sealed away behind his eye. They were there through his eternity of suffering. They will accompany him yet, in his hideous new form born when he destroyed the grace granted by his mother. They have accepted his fate as much as he.",helm,"[{'Phy': '3.1', 'VS Str.': '3.1', 'VS Sla.': '2.8', 'VS Pie.': '3.6', 'Mag': '3.4', 'Fir': '4.2', 'Lit': '4.0', 'Hol': '3.4'}]","[{'Imm.': '24', 'Rob.': '16', 'Foc.': '23', 'Vit.': '24', 'Poi.': '5'}]",3.3,Slightly enhances incantations of Messmer's fire and Fire Knight skills by 3%.,Alter Messmer's Helm at any site of grace.,17,1
29,Gravebird Helm,http://eldenring.wiki.fextralife.com/file/Elden-Ring/gravebird_helm_helm_elden_ring_shadow_of_the_erdtree_dlc_wiki_guide_200px.png,"Stone helm with a tinge of green. One of a set of armor pieces cast in the image of the Gravebird. Empowers spells which summon rings of spectral light. Gravebirds are ancient golems, created to guard the spiritgraves built where all manners of Death ultimately drift.",helm,"[{'Phy': '3.4', 'VS Str.': '3.6', 'VS Sla.': '3.6', 'VS Pie.': '3.1', 'Mag': '4.0', 'Fir': '3.8', 'Lit': '4.2', 'Hol': '4.2'}]","[{'Imm.': '24', 'Rob.': '14', 'Foc.': '21', 'Vit.': '20', 'Poi.': '6'}]",3.6,Empowers spells which summon rings of spectral light by 15%.,"From the Spiral Rise site of grace, climb the spire until you get the elevator shortcut back down. Ride the lift down and jump off halfway into a central altar. [Map Link]",19,1
30,Common Soldier Helm,http://eldenring.wiki.fextralife.com/file/Elden-Ring/common_soldier_helm_helm_elden_ring_shadow_of_the_erdtree_dlc_wiki_guide_200px.png,"Helm of the rank-and-file soldiers of Messmer's army. A pitch-dark soot clings to it, much like the inner faces of the men who wore them.",helm,"[{'Phy': '4.4', 'VS Str.': '3.4', 'VS Sla.': '4.2', 'VS Pie.': '4.2', 'Mag': '2.5', 'Fir': '3.1', 'Lit': '2.1', 'Hol': '2.8'}]","[{'Imm.': '11', 'Rob.': '20', 'Foc.': '8', 'Vit.': '8', 'Poi.': '6'}]",3.8,,Drop by soldiers in Castle Ensis,5,1
31,Horned Warrior Helm,http://eldenring.wiki.fextralife.com/file/Elden-Ring/horned_warrior_helm_helm_elden_ring_shadow_of_the_erdtree_dlc_wiki_guide_200px.png,"Helm featuring a crown of sturdy tangled horns, allowing the wearer to invoke divinity. Attire of the horned warriors, keepers of the tower. Divine invocation bolsters the strength of the wearer, but causes the blessing of the Erdtree to become nauseating, reducing the restorative effect of drinking from a flask of sacred tears. Focus is also troubled by wearing this helm.",helm,"[{'Phy': '4.8', 'VS Str.': '4.4', 'VS Sla.': '4.6', 'VS Pie.': '4.0', 'Mag': '3.6', 'Fir': '3.6', 'Lit': '3.1', 'Hol': '3.1'}]","[{'Imm.': '13', 'Rob.': '25', 'Foc.': '0', 'Vit.': '9', 'Poi.': '7'}]",4.6,"Increases Strength by +5, but decreases healing from Flask of Crimson Tears by -7%.",Dropped from Horned Warriors,3,1
