id,name,image,description,type,damage negation,resistance,weight,special effect,how to acquire,in-game section,dlc
345,All-Knowing Armor (Altered),http://eldenring.wiki.fextralife.com/file/Elden-Ring/all-knowing_armor_(altered)_elden_ring_wiki_guide_200px.png,"Armor set with countless eyes and ears. Worn by Gideon Ofnir, the All-Knowing. Knowledge begins with the recognition of one's ignorance. The realization that the search for knowledge is unending. But when Gideon glimpsed into the will of Queen Marika, he shuddered in fear. At the end that should not be.",chest armor,"[{'Phy': '12.4', 'VS Str': '10.9', 'VS Sla': '12.9', 'VS Pie': '11.4', 'Mag': '11.4', 'Fir': '8.8', 'Lit': '9.5', 'Hol': '8'}]","[{'Imm.': '22', 'Rob.': '38', 'Foc.': '16', 'Vit.': '16', 'Poi.': '21'}]",9.3,,"After completing Boc's Questline, you (or Boc) can alter All-Knowing Armor into All-Knowing Armor (Altered).",9,Base Game
346,Aristocrat Garb (Altered),http://eldenring.wiki.fextralife.com/file/Elden-Ring/aristocrat_garb_(altered)_elden_ring_wiki_guide_200px.png,"High quality garb adorned with fine golden embroidery.Travel attire worn by nobles in the capital. Terribly faded and tattered.Abandoning their birthplace after the Shattering, these pitiful wanderers are the pitiful product of unending life.",chest armor,"[{'Phy': '7.1', 'VS Str': '8', 'VS Sla': '7.1', 'VS Pie': '7.1', 'Mag': '6.1', 'Fir': '6.7', 'Lit': '7.1', 'Hol': '6.1'}]","[{'Imm.': '42', 'Rob.': '29', 'Foc.': '32', 'Vit.': '25', 'Poi.': '10'}]",4.1,,Drops from the Aristocrat enemies found wandering the roads in most areas.An early spot to farm them is the traveling carriage escort on the road north of the Agheel Lake South site of grace.,1,Base Game
347,Astrologer Robe (Altered),http://eldenring.wiki.fextralife.com/file/Elden-Ring/astrologer_robe_(altered)_elden_ring_wiki_guide_200px.png,"Robe fashioned from supple cloth. Worn by those who look to the cosmos above. They read fate in the stars, and are said to be heirs of the glintstone sorcerers. But alas, the night sky no longer cradles fate.",chest armor,"[{'Phy': '6.1', 'VS Str': '5.3', 'VS Sla': '5.3', 'VS Pie': '5.3', 'Mag': '13.3', 'Fir': '12.8', 'Lit': '13', 'Hol': '12.8'}]","[{'Imm.': '42', 'Rob.': '21', 'Foc.': '75', 'Vit.': '64', 'Poi.': '10'}]",5.3,,"After completing Boc's Questline, you (or Boc) can alter Astrologer Robe into Astrologer Tobe (Altered).",2,Base Game
348,Banished Knight Armor (Altered),http://eldenring.wiki.fextralife.com/file/Elden-Ring/banished_knight_armor_(altered)_elden_ring_wiki_guide_200px.png,"Thick, full set of armor covering the entire body. This armor was worn by knights who, whether by misfortune or misdeed, were forced to abandon their homes. These fierce warriors were each and all accomplished. Perhaps that is why, despite their territorial losses, they were still named knights.",chest armor,"[{'Phy': '18.3', 'VS Str': '14.4', 'VS Sla': '18.7', 'VS Pie': '16.8', 'Mag': '13.3', 'Fir': '13.3', 'Lit': '12.8', 'Hol': '13'}]","[{'Imm.': '52', 'Rob.': '69', 'Foc.': '32', 'Vit.': '34', 'Poi.': '33'}]",16.5,,Stormveil Castle. Dropped by the Banished Knight in the room with the human limbs hanging from the roof.Cathedral of Dragon Communion. Dropped by the Banished Knight patrolling the perimeter of the Cathedral.,10,Base Game
349,Battlemage Robe,http://eldenring.wiki.fextralife.com/file/Elden-Ring/battlemage_robe_elden_ring_wiki_guide_200px.png,"Robe worn by scholars of the Raya Lucaria Academy, tattered from being worn on the battlefield.Whenever war broke out and the academy sealed its gates, only Haima's scholars dared venture outside. Seclusion is no way to foster discovery; it is only a convenient form of escape.",chest armor,"[{'Phy': '5.3', 'VS Str': '6.1', 'VS Sla': '4.2', 'VS Pie': '5.3', 'Mag': '13', 'Fir': '11.9', 'Lit': '12.4', 'Hol': '12.6'}]","[{'Imm.': '42', 'Rob.': '23', 'Foc.': '63', 'Vit.': '71', 'Poi.': '10'}]",4.1,,This piece is dropped by Battlemage enemies.,2,Base Game
350,Beast Champion Armor (Altered),http://eldenring.wiki.fextralife.com/file/Elden-Ring/beast_champion_armor_(altered)_elden_ring_wiki_guide_200px.png,"Silver armor engraved with tiny beasts.Worn by Bernahl the Recusant.Beasts are drawn to champions, and to lords. And this armor befits a champion worthy of becoming a lord. And that is what Bernahl was.Until his maiden threw herself into the fire.",chest armor,"[{'Phy': '17.2', 'VS Str': '15.9', 'VS Sla': '18.5', 'VS Pie': '18.2', 'Mag': '12.9', 'Fir': '13.7', 'Lit': '12.7', 'Hol': '13.4'}]","[{'Imm.': '50', 'Rob.': '75', 'Foc.': '34', 'Vit.': '32', 'Poi.': '34'}]",16.4,,"Drops from Knight Bernahl upon death. If not killed before, he will eventually invade you at Crumbling Farum Azula, dropping the entire set with an altered version of the chest piece. Elden Ring Map here.",10,Base Game
351,Black Knife Armor (Altered),http://eldenring.wiki.fextralife.com/file/Elden-Ring/black_knife_armor_(altered)_elden_ring_wiki_guide_200px.png,"Armor used by the Black Knife Assassins. Crafted with scale armor that makes no sound. The assassins that carried out the deeds of the Night of the Black Knives were all women, and rumored to be Numen who had close ties with Marika herself.",chest armor,"[{'Phy': '11.3', 'VS Str': '10.8', 'VS Sla': '12.3', 'VS Pie': '12.3', 'Mag': '8.7', 'Fir': '9.4', 'Lit': '6.6', 'Hol': '11.3'}]","[{'Imm.': '25', 'Rob.': '42', 'Foc.': '21', 'Vit.': '21', 'Poi.': '19'}]",9.0,,Boc the Seamster can alter the original Black Knife Armor if you have it in your possession.,7,Base Game
352,Blaidd's Armor,http://eldenring.wiki.fextralife.com/file/Elden-Ring/blaidds_armor_elden_ring_wiki_guide_200px.png,"Well-worn black armor of the man-wolf BlaiddThe pelt serves as a cape, protecting from cold.Blaidd was the blade of Ranni, but the cold bothered him anyway.",chest armor,"[{'Phy': '14.6', 'VS Str': '12.9', 'VS Sla': '14.6', 'VS Pie': '15.3', 'Mag': '11.4', 'Fir': '12.6', 'Lit': '10.2', 'Hol': '11.9'}]","[{'Imm.': '38', 'Rob.': '76', 'Foc.': '25', 'Vit.': '25', 'Poi.': '28'}]",13.7,,"Following Ranni's questline, after she is given the Dark Moon Ring, return to Ranni's Rise and you will hear Blaidd talking to himself in front of the tower. When he finishes his dialogue he will turn hostile, and defeating him will grant the player Blaidd's Armor, Blaidd's Gauntlets, and Blaidd's Greaves (as well as the Royal Greatsword).Elden Ring Map here",9,Base Game
353,Blaidd's Armor (Altered),http://eldenring.wiki.fextralife.com/file/Elden-Ring/blaidds_armor_(altered)_elden_ring_wiki_guide_200px.png,"Well-worn black armor of the man-wolf Blaidd. Blaidd, who served as Ranni's shadow, was a loyal ally who would defy destiny itself if it would have him turn upon his Lady.",chest armor,"[{'Phy': '14', 'VS Str': '12.4', 'VS Sla': '14', 'VS Pie': '14.6', 'Mag': '10.9', 'Fir': '12.4', 'Lit': '9.5', 'Hol': '11.4'}]","[{'Imm.': '32', 'Rob.': '57', 'Foc.': '22', 'Vit.': '21', 'Poi.': '27'}]",12.5,,Boc the Seamster can alter the original Blaidd's Armor if you have it in your possession.,9,Base Game
354,Bloodhound Knight Armor (Altered),http://eldenring.wiki.fextralife.com/file/Elden-Ring/bloodhound_knight_armor_(altered)_elden_ring_wiki_guide_200px.png,"Metal armor with a jutting breastplate. Worn by the Bloodhound Knights. The Bloodhound Knights are trained as hunters and known to be unshakable trackers. Without the use of language, each knight chooses his own master. Once the decision has been made, the knight stays loyal for life.",chest armor,"[{'Phy': '12.1', 'VS Str': '11.1', 'VS Sla': '13.7', 'VS Pie': '13.2', 'Mag': '9.2', 'Fir': '9.9', 'Lit': '6.8', 'Hol': '9.9'}]","[{'Imm.': '29', 'Rob.': '45', 'Foc.': '21', 'Vit.': '21', 'Poi.': '19'}]",9.6,,"After completing Boc's Questline, you (or Boc) can alter Bloodhound Knight Armor into Bloodhound Knight Armor (Altered).",8,Base Game
355,Bloodsoaked Tabard,http://eldenring.wiki.fextralife.com/file/Elden-Ring/bloodsoaked_tabard_elden_ring_wiki_guide_200px.png,Padded cloth armor with indelible bloodstains around the neck.Worn by headless foot soldiers who endlessly guard the Wandering Mausoleum.,chest armor,"[{'Phy': '9.5', 'VS Str': '9.5', 'VS Sla': '10.2', 'VS Pie': '9.5', 'Mag': '10.9', 'Fir': '10.9', 'Lit': '12.4', 'Hol': '11.4'}]","[{'Imm.': '63', 'Rob.': '38', 'Foc.': '55', 'Vit.': '50', 'Poi.': '18'}]",8.3,,Drops from Mausoleum Foot Soldiers.,5,Base Game
356,Blue Festive Garb,http://eldenring.wiki.fextralife.com/file/Elden-Ring/festive_garb_elden_ring_wiki_guide_200px.png,"Ceremonial garb worn by dancers at the festivities in Dominula, the village of windmills. Use of this garb, dyed in a stunning blue, is only permitted for the young maids who play the central role in the festival.",chest armor,"[{'Phy': '4.2', 'VS Str': '4.2', 'VS Sla': '6.1', 'VS Pie': '5.3', 'Mag': '12.6', 'Fir': '11.4', 'Lit': '12.6', 'Hol': '13.8'}]","[{'Imm.': '46', 'Rob.': '21', 'Foc.': '71', 'Vit.': '63', 'Poi.': '7'}]",4.1,,"The set pieces are dropped by dancers in Dominula, Windmill Village. The regular festive set is dropped by those wearing the yellow hood and garb.",1,Base Game
357,Blue Silver Mail Armor (Altered),http://eldenring.wiki.fextralife.com/file/Elden-Ring/blue_silver_mail_armor_(altered)_elden_ring_wiki_guide_200px.png,"Chainmail armor crafted with blue silver. Worn by the wolf-riding Albinauric archers. Blue silver is a metal born from the same mother as the archers themselves, and provides protection from magic and frost.",chest armor,"[{'Phy': '12.1', 'VS Str': '9', 'VS Sla': '12.6', 'VS Pie': '11.1', 'Mag': '10.4', 'Fir': '9.7', 'Lit': '7.3', 'Hol': '7.3'}]","[{'Imm.': '21', 'Rob.': '52', 'Foc.': '10', 'Vit.': '10', 'Poi.': '17'}]",8.5,,"Boc the Seamster can alter the original Blue Silver Mail Armor, if you have it in your possession.",7,Base Game
358,Brave's Battlewear,http://eldenring.wiki.fextralife.com/file/Elden-Ring/braves_battlewear_elden_ring_wiki_guide_200px.png,"Battlewear fashioned from leather armor adorned with a large sheet of cloth. Garb worn by warriors of the frigid uplands. The red cloth signifies participation in the Long March long, long ago and this ceremonial garb beseeches the favor of the Warrior King who led them.",chest armor,"[{'Phy': '5.3', 'VS Str': '5.3', 'VS Sla': '5.3', 'VS Pie': '4.2', 'Mag': '12.8', 'Fir': '12.4', 'Lit': '12.6', 'Hol': '12.8'}]","[{'Imm.': '42', 'Rob.': '23', 'Foc.': '67', 'Vit.': '67', 'Poi.': '8'}]",4.1,,This Chest Armor is currently unobtainable.,Base Game,Base Game
359,Brave's Battlewear (Altered),http://eldenring.wiki.fextralife.com/file/Elden-Ring/braves_battlewear_(altered)_elden_ring_wiki_guide_200px.png,Helm wrapped in thick leather. Garb worn by warriors of the frigid uplands.,chest armor,"[{'Phy': '4.2', 'VS Str': '4.2', 'VS Sla': '4.2', 'VS Pie': '2.7', 'Mag': '12.6', 'Fir': '11.9', 'Lit': '12.4', 'Hol': '12.6'}]","[{'Imm.': '34', 'Rob.': '19', 'Foc.': '57', 'Vit.': '57', 'Poi.': '7'}]",3.2,,This Chest Armor is currently unobtainable.,0,0
360,Briar Armor (Altered),http://eldenring.wiki.fextralife.com/file/Elden-Ring/briar_armor_(altered)_elden_ring_wiki_guide_200px.png,"Battered iron armor from a foreign land. Worn by Elemer of the Briar. The winding, rusted iron briars are a mark of the guilty, and typically indicate a sentence of death. They also cause this armor to deal damage when performing dodge rolls. Elemer murdered numerous instructors and merchants, and was known as the Bell Bearing Hunter.",chest armor,"[{'Phy': '12.4', 'VS Str': '10.9', 'VS Sla': '12.4', 'VS Pie': '11.9', 'Mag': '10.2', 'Fir': '11.4', 'Lit': '7.1', 'Hol': '9.5'}]","[{'Imm.': '29', 'Rob.': '61', 'Foc.': '21', 'Vit.': '21', 'Poi.': '19'}]",10.7,,"Boc the Seamster can alter the original Briar Armor, if you have it in your possession.",9,Base Game
361,Carian Knight Armor (Altered),http://eldenring.wiki.fextralife.com/file/Elden-Ring/carian_knight_armor_(altered)_elden_ring_wiki_guide_200px.png,"Armor of the enchanted knights that once served the Carian royal family. The enchanted knights, anointed by the Lunar Queen, were all heroes of the highest honors, but fell into disarray with the decline of the royal family.",chest armor,"[{'Phy': '11.7', 'VS Str': '9.8', 'VS Sla': '12.2', 'VS Pie': '11.7', 'Mag': '11.7', 'Fir': '11.7', 'Lit': '9.1', 'Hol': '11.7'}]","[{'Imm.': '22', 'Rob.': '38', 'Foc.': '16', 'Vit.': '19', 'Poi.': '18'}]",9.7,,"After completing Boc's Questline, you (or Boc) can alter Carian Knight Armor into Carian Knight Armor (Altered).",8,Base Game
362,Cleanrot Armor (Altered),http://eldenring.wiki.fextralife.com/file/Elden-Ring/cleanrot_armor_(altered)_elden_ring_wiki_guide_200px.png,"Armor of the Cleanrot Knights, celebrated for their undefeated campaign in the Shattering. The Cleanrot Knights vowed to fight alongside Malenia, despite the inevitable, if gradual, putrefaction of their flesh. Their acceptance of their fate made these battles the fiercest of all.",chest armor,"[{'Phy': '13.5', 'VS Str': '12.4', 'VS Sla': '14.6', 'VS Pie': '16', 'Mag': '11.9', 'Fir': '12.4', 'Lit': '10.2', 'Hol': '13'}]","[{'Imm.': '52', 'Rob.': '54', 'Foc.': '22', 'Vit.': '22', 'Poi.': '24'}]",13.7,,"After completing Boc's Questline, you (or Boc) can alter Cleanrot Armor into Cleanrot Armor (Altered).",8,Base Game
363,Commoner's Garb (Altered),http://eldenring.wiki.fextralife.com/file/Elden-Ring/commoners_garb_(altered)_elden_ring_wiki_guide_200px.png,"Garb decorated with intricate embroidery.Standard wear for commoners of the Lands Between.The board hung from the neck depicts a sprawling tree, its roots and branches forming two holes. This is a self-imposed shackle, a voluntary display of allegiance to the Erdtree that increases faith.",chest armor,"[{'Phy': '4.2', 'VS Str': '6.1', 'VS Sla': '6.1', 'VS Pie': '5.3', 'Mag': '12.6', 'Fir': '11.9', 'Lit': '12.4', 'Hol': '12.6'}]","[{'Imm.': '34', 'Rob.': '21', 'Foc.': '61', 'Vit.': '64', 'Poi.': '7'}]",4.1,+1 Faith,"Commoner's Garb is dropped by Commoner enemies found in Stormveil Castle, Leyndell, Royal Capital, and other areas of the map.",1,Base Game
364,Commoner's Simple Garb (Altered),http://eldenring.wiki.fextralife.com/file/Elden-Ring/commoners_simple_garb_(altered)_elden_ring_wiki_guide_200px.png,"Modest garb made of cloth.Standard wear for Commoners of the Lands Between.The board hung from the neck depicts a sprawling tree, its roots and branches forming two holes. This is a self-imposed shackle, a voluntary display of allegiance to the Erdtree that increases faith.",chest armor,"[{'Phy': '3.2', 'VS Str': '6.1', 'VS Sla': '6.1', 'VS Pie': '5.3', 'Mag': '12.8', 'Fir': '12.4', 'Lit': '12.4', 'Hol': '12.6'}]","[{'Imm.': '38', 'Rob.': '21', 'Foc.': '61', 'Vit.': '64', 'Poi.': '7'}]",4.1,+1 Faith,Commoner's Simple Garb is found Stormveil Castle. Located on a corpse on the balcony just outside the Gateside Chamber site of grace room.,1,Base Game
365,Confessor Armor (Altered),http://eldenring.wiki.fextralife.com/file/Elden-Ring/confessor_armor_(altered)_elden_ring_wiki_guide_200px.png,"Black leather armor for blending in with the darkness. Worn by church confessors. The churches outside the Lands Between, dedicated to the teachings of the Two Fingers, send confessors out to follow the guidance of grace. The confessors are loyal servants to the Two Fingers, ready to hunt down and quietly dispose of their enemies.",chest armor,"[{'Phy': '7.6', 'VS Str': '9.8', 'VS Sla': '7.6', 'VS Pie': '8.4', 'Mag': '10.5', 'Fir': '10.5', 'Lit': '11.5', 'Hol': '9.1'}]","[{'Imm.': '54', 'Rob.': '42', 'Foc.': '42', 'Vit.': '45', 'Poi.': '15'}]",7.3,,"After completing Boc's Questline, you (or Boc) can alter Confessor Armor into Confessor Armor (Altered).",4,Base Game
366,Consort's Robe,http://eldenring.wiki.fextralife.com/file/Elden-Ring/consorts_robe_elden_ring_wiki_guide_200px.png,"Fine robe of white silk worn by Tanith, Lady of the Volcano Manor.Long ago, when Rykard first set eyes on Tanith, she was working as a dancer in a foreign land. Soon, he made her his consort.She was the only human to remain by his side when he became the serpent of blasphemy.In that moment, Tanith was truly charmed by him.",chest armor,"[{'Phy': '5.3', 'VS Str': '4.2', 'VS Sla': '4.2', 'VS Pie': '5.3', 'Mag': '13', 'Fir': '12.4', 'Lit': '12.4', 'Hol': '12.8'}]","[{'Imm.': '46', 'Rob.': '25', 'Foc.': '67', 'Vit.': '63', 'Poi.': '7'}]",4.1,,"Looted from the corpse of Tanith after attacking her and defeating the summoned Tanith's Knight near the Rykard, Lord of Blasphemy Site of Grace in Volcano Manor, Altus Plateau. Elden Ring Map here.",3,Base Game
367,Corhyn's Robe,http://eldenring.wiki.fextralife.com/file/Elden-Ring/corhyns_robe_elden_ring_wiki_guide_200px.png,"Robe of Corhyn the cleric.Even after exile, Corhyn refused to recant his prophecies. And for this, he was blessed with the guidance of grace.Since then, the cart wheel draped on his neck has served as a reminder. That true guidance awaits those with iron wills. Those with unwavering faith.",chest armor,"[{'Phy': '6.1', 'VS Str': '6.7', 'VS Sla': '6.7', 'VS Pie': '6.1', 'Mag': '13.3', 'Fir': '12.8', 'Lit': '12.8', 'Hol': '13.5'}]","[{'Imm.': '46', 'Rob.': '24', 'Foc.': '107', 'Vit.': '76', 'Poi.': '10'}]",6.3,,"Dropped by Corhyn at the end of his questline, in Leyndell, Capital of Ash. Elden Ring Map here",2,Base Game
368,Crucible Axe Armor (Altered),http://eldenring.wiki.fextralife.com/file/Elden-Ring/crucible_axe_armor_(altered)_elden_ring_wiki_guide_200px.png,"Armor of the Crucible Knights who served Godfrey, the first Elden Lord. Worn by the knight Ordovis and his men. Holds the power of the crucible of life, the primordial form of the Erdtree. Strengthens Aspects of the Crucible incantations.",chest armor,"[{'Phy': '16.8', 'VS Str': '13.4', 'VS Sla': '16', 'VS Pie': '16', 'Mag': '12.8', 'Fir': '12.6', 'Lit': '10.9', 'Hol': '13.3'}]","[{'Imm.': '42', 'Rob.': '61', 'Foc.': '29', 'Vit.': '29', 'Poi.': '31'}]",14.9,Strengthens Aspects of the Crucible incantations,"After completing Boc's Questline, you (or Boc) can alter Crucible Axe Armor into Crucible Axe Armor (Altered).",10,Base Game
369,Crucible Tree Armor (Altered),http://eldenring.wiki.fextralife.com/file/Elden-Ring/crucible_tree_armor_(altered)_elden_ring_wiki_guide_200px.png,"Armor of the Crucible Knights who served Godfrey, the first Elden Lord. Worn by the knight Siluria and her men. Holds the power of the crucible of life, the primordial form of the Erdtree. Strengthens Aspects of the Crucible incantations.",chest armor,"[{'Phy': '17', 'VS Str': '13.4', 'VS Sla': '16', 'VS Pie': '15.6', 'Mag': '12.8', 'Fir': '11.4', 'Lit': '10.9', 'Hol': '14.1'}]","[{'Imm.': '42', 'Rob.': '61', 'Foc.': '29', 'Vit.': '29', 'Poi.': '31'}]",14.9,Strengthens Aspects of the Crucible incantations,"After completing Boc's Questline, you (or Boc) can alter Crucible Tree Armor into Crucible Tree Armor (Altered).",10,Base Game
370,Cuckoo Knight Armor,http://eldenring.wiki.fextralife.com/file/Elden-Ring/cuckoo_knight_armor_elden_ring_wiki_guide_200px.png,"Armor worn by Raya Lucaria Academy knights.Its left breast is emblazoned with a peering cuckoo, whence came their name.Perhaps the bird's shrewd gaze is an expression of their refusal to be mere servants of the academy.",chest armor,"[{'Phy': '13.5', 'VS Str': '11.4', 'VS Sla': '14.6', 'VS Pie': '13.5', 'Mag': '12.4', 'Fir': '11.9', 'Lit': '8.8', 'Hol': '10.2'}]","[{'Imm.': '32', 'Rob.': '57', 'Foc.': '24', 'Vit.': '24', 'Poi.': '24'}]",11.8,,"Dropped from Raya Lucaria Academy Knights, also referred to as Cuckoo Knights. There are three nearby to the East Raya Lucaria Gate site of grace.",8,Base Game
371,Cuckoo Knight Armor (Altered),http://eldenring.wiki.fextralife.com/file/Elden-Ring/cuckoo_knight_armor_(altered)_elden_ring_wiki_guide_200px.png,"Armor worn by Raya Lucaria Academy knights. Its left breast is emblazoned with a peering cuckoo, whence came their name. Perhaps the bird's shrewd gaze is an expression of their refusal to be mere servants of the academy.",chest armor,"[{'Phy': '13.1', 'VS Str': '11', 'VS Sla': '14.2', 'VS Pie': '13.1', 'Mag': '12', 'Fir': '11.5', 'Lit': '8.4', 'Hol': '9.8'}]","[{'Imm.': '29', 'Rob.': '52', 'Foc.': '21', 'Vit.': '21', 'Poi.': '24'}]",10.8,,"Dropped from Raya Lucaria Academy Knights, also referred to as Cuckoo Knights. There are three nearby to the East Raya Lucaria Gate site of grace.",8,Base Game
372,Depraved Perfumer Robe (Altered),http://eldenring.wiki.fextralife.com/file/Elden-Ring/depraved_perfumer_robe_(altered)_elden_ring_wiki_guide_200px.png,Robe worn by depraved perfumers. The embroidery on the apron is itself a curse upon the Erdtree. These heresy-inclined perfumers imbibe their own spices to alter body and mind. Their slow descent into self-destruction is what earned them their name.,chest armor,"[{'Phy': '5.3', 'VS Str': '5.2', 'VS Sla': '4.1', 'VS Pie': '2.6', 'Mag': '13', 'Fir': '12.6', 'Lit': '12.4', 'Hol': '12.6'}]","[{'Imm.': '63', 'Rob.': '18', 'Foc.': '48', 'Vit.': '63', 'Poi.': '7'}]",4.0,,Drops from Depraved Perfumers.,3,Base Game
373,Dirty Chainmail,http://eldenring.wiki.fextralife.com/file/Elden-Ring/dirty_chainmail_elden_ring_wiki_guide_200px.png,Chainmail worn by young Albinaurics.The appearance of a protruding belly provides no benefits worthy of note.,chest armor,"[{'Phy': '11.4', 'VS Str': '8.8', 'VS Sla': '11.9', 'VS Pie': '11.4', 'Mag': '8', 'Fir': '8.8', 'Lit': '6.1', 'Hol': '8'}]","[{'Imm.': '25', 'Rob.': '50', 'Foc.': '21', 'Vit.': '21', 'Poi.': '18'}]",8.8,,Dropped by the Second Generation Albinaurics that are visibly wearing the chest piece.An easily farmable group of 4 is located near the Academy Gate Town site of grace in Liurnia of the Lakes. Head northwest from the site of grace until you reach an L-shaped building with a small tower at the corner. There will be 2 on the left sloped roof and 2 near the tower that can all drop the chest.,6,Base Game
374,Drake Knight Armor,http://eldenring.wiki.fextralife.com/file/Elden-Ring/drake_knight_armor_elden_ring_wiki_guide_200px.png,"Black iron armor worn by drake knights.Features the spoils of a dragon catch as an emblem of pride as both dragon hunter and partake of communion.The cape is crafted with dragon wing membrane.Altered:From birth, drake knights speak not a word. They spend their lives pursuing the strength of dragons, for its sublime beauty and inspiration of awe.",chest armor,"[{'Phy': '11.4', 'VS Str': '9.5', 'VS Sla': '11.9', 'VS Pie': '11.4', 'Mag': '10.2', 'Fir': '11.4', 'Lit': '8.8', 'Hol': '10.2'}]","[{'Imm.': '25', 'Rob.': '46', 'Foc.': '21', 'Vit.': '21', 'Poi.': '19'}]",9.2,,You can find the Drake Knight Set in Crumbling Farum Azula.Travel to the Beside The Great Bridge site of grace and go in the opposite direction of the boss room. Go through the building and outside onto the balcony. From here drop down to the Beastman with the big cleaver. Go along the bridge and call up the elevator. Ride the Elevator down and go Outside. The Drake Knight Set is on the left in a big chest. [Elden Ring Map here],9,Base Game
375,Drake Knight Armor (Altered),http://eldenring.wiki.fextralife.com/file/Elden-Ring/drake_knight_armor_(altered)_elden_ring_wiki_guide_200px.png,"Black iron armor worn by drake knights. Features the spoils of a dragon catch as an emblem of pride as both dragon hunter and partaker of communion. From birth, drake knights speak not a word. They spend their lives pursuing the strength of dragons, for its sublime beauty and inspiration of awe.",chest armor,"[{'Phy': '11.2', 'VS Str': '8.6', 'VS Sla': '11.2', 'VS Pie': '10.7', 'Mag': '8', 'Fir': '9.5', 'Lit': '6.7', 'Hol': '8'}]","[{'Imm.': '21', 'Rob.': '34', 'Foc.': '10', 'Vit.': '10', 'Poi.': '16'}]",8.3,,"Boc the Seamster can alter the original Drake Knight Armor, if you have it in your possession.",9,Base Game
376,Elden Lord Armor (Altered),http://eldenring.wiki.fextralife.com/file/Elden-Ring/elden_lord_armor_(altered)_elden_ring_wiki_guide_200px.png,"Armor of Godfrey, the first Elden Lord. The age of the Erdtree began amongst conflict, when Godfrey was lord of the battlefield. He led the War against the Giants. Faced the Storm Lord, alone. And then, there came a moment. When his last worthy enemy fell. And it was then, as the story is told, that the hue of Lord Godfrey's eyes faded.",chest armor,"[{'Phy': '11.1', 'VS Str': '9.9', 'VS Sla': '10.6', 'VS Pie': '11.6', 'Mag': '7.7', 'Fir': '10.6', 'Lit': '6.4', 'Hol': '6.8'}]","[{'Imm.': '22', 'Rob.': '45', 'Foc.': '10', 'Vit.': '16', 'Poi.': '17'}]",8.4,,"After completing Boc's Questline, you (or Boc) can alter Elden Lord Armor into Elden Lord Armor (Altered).",7,Base Game
377,Errant Sorcerer Robe (Altered),http://eldenring.wiki.fextralife.com/file/Elden-Ring/errant_sorcerer_robe_(altered)_elden_ring_wiki_guide_200px.png,"Commonplace robe made of thick cloth. Worn by the Errant Sorcerer Wilhelm, one of the first Tarnished to visit Roundtable Hold. A silent seeker of sorcery, who had gone so far as to make contact with the primeval current, Wilhelm was led by guidance into confrontation with his friend Vargram, and it is said that he was then taken prisoner in Roundtable Hold.",chest armor,"[{'Phy': '2.7', 'VS Str': '2.7', 'VS Sla': '5.3', 'VS Pie': '2.7', 'Mag': '12.8', 'Fir': '12.4', 'Lit': '11.9', 'Hol': '12.8'}]","[{'Imm.': '31', 'Rob.': '20', 'Foc.': '62', 'Vit.': '66', 'Poi.': '7'}]",3.2,,"After completing Boc's Questline, you (or Boc) can alter Errant Sorcerer Robe into Errant Sorcerer Robe (Altered).",2,Base Game
