id,name,image,description,type,damage negation,resistance,weight,special effect,how to acquire,in-game section,dlc
515,Depraved Perfumer Gloves,http://eldenring.wiki.fextralife.com/file/Elden-Ring/depraved_perfumer_gloves_elden_ring_wiki_guide_200px.png,Gloves worn by depraved perfumers.These heresy-inclined perfumers imbibe their own spices to alter body and mind. Their slow descent into self-destruction is what earned them their name.,gauntlets,"[{'Phy': '1.5', 'VS Str': '1.5', 'VS Sla': '1.4', 'VS Pie': '1.2', 'Mag': '3.2', 'Fir': '3.1', 'Lit': '3.1', 'Hol': '3.1'}]","[{'Imm.': '23', 'Rob.': '8', 'Foc.': '20', 'Vit.': '28', 'Poi.': '2'}]",2.0,,The Depraved Perfumer Set pieces can be farmed from the Depraved Perfumer enemies located around The Shaded Castle,3,0
516,Drake Knight Gauntlets,http://eldenring.wiki.fextralife.com/file/Elden-Ring/drake_knight_gauntlets_elden_ring_wiki_guide_200px.png,"Black iron gauntlets worn by drake knights.Features the spoils of a dragon catch as an emblem of pride as both dragon hunter and partaker of communion.From birth, drake knights speak not a word. They spend their lives pursuing the strength of dragons, for its sublime beauty and inspiration of awe",gauntlets,"[{'Phy': '2.8', 'VS Str': '2.3', 'VS Sla': '2.9', 'VS Pie': '2.8', 'Mag': '2.5', 'Fir': '2.8', 'Lit': '2.1', 'Hol': '2.5'}]","[{'Imm.': '8', 'Rob.': '15', 'Foc.': '7', 'Vit.': '7', 'Poi.': '4'}]",3.1,,You can find the Drake Knight Set in Crumbling Farum Azula.Elden Ring Map hereTravel to the Beside The Great Bridge site of grace and go in the opposite direction of the boss room. Go through the building and outside onto the balcony. From here drop down to the Beastman with the big cleaver. Go along the bridge and call up the elevator. Ride the Elevator down and go Outside. The Drake Knight Set is on the left in a big chest.,8,0
517,Eccentric's Manchettes,http://eldenring.wiki.fextralife.com/file/Elden-Ring/eccentrics_manchettes_elden_ring_wiki_guide_200px.png,"The knight Jerren's manchettes. Jerren preferred a nomadic existence, but after spending time as a guest of the Carian royals, he became the guest commander for General Radahn. And for the first time, the restless tumbleweed would be bound by honorable oath.",gauntlets,"[{'Phy': '2.9', 'VS Str': '2.1', 'VS Sla': '2.8', 'VS Pie': '2.9', 'Mag': '2.1', 'Fir': '2.3', 'Lit': '1.5', 'Hol': '1.9'}]","[{'Imm.': '8', 'Rob.': '18', 'Foc.': '6', 'Vit.': '4', 'Poi.': '4'}]",2.9,,This armor piece is obtained as part of a set after the defeat of Witch-Hunter Jerren. This could be done as part of Sorceress Sellen's questline. Players will be given the option to side with Sellen or Jerren in Raya Lucaria Academy.Elden Ring Map here,6,0
518,Elden Lord Bracers,http://eldenring.wiki.fextralife.com/file/Elden-Ring/elden_lord_bracers_elden_ring_wiki_guide_200px.png,"Bracers of Godfrey the first Elden Lord.The age of the Erdtree began amongst conflict, when Godfrey was lord of the battlefield.He led the War against the Giants. Faced the Storm Lord, alone. And then, there came a moment. When his last worthy enemy fell. And it was then, as the story is told, that the hue of Lord Godfrey's eyes faded.",gauntlets,"[{'Phy': '2.9', 'VS Str': '2.7', 'VS Sla': '2.8', 'VS Pie': '3.1', 'Mag': '2.1', 'Fir': '2.8', 'Lit': '1.7', 'Hol': '1.9'}]","[{'Imm.': '11', 'Rob.': '18', 'Foc.': '6', 'Vit.': '7', 'Poi.': '4'}]",3.1,,"Available from Enia after defeating Godfrey, First Elden Lord and Hoarah Loux, Warrior.",6,0
519,Errant Sorcerer Manchettes,http://eldenring.wiki.fextralife.com/file/Elden-Ring/errant_sorcerer_manchettes_elden_ring_wiki_guide_200px.png,Commonplace leather manchettes.Their hands are inlaid with dulled glintstone.,gauntlets,"[{'Phy': '0.6', 'VS Str': '0.6', 'VS Sla': '1.3', 'VS Pie': '0.6', 'Mag': '3.2', 'Fir': '3.1', 'Lit': '2.9', 'Hol': '3.2'}]","[{'Imm.': '11', 'Rob.': '7', 'Foc.': '21', 'Vit.': '22', 'Poi.': '1'}]",1.1,,"Looted off a corpse in Hermit Village, Mt. Gelmir. The corpse is found in a house in the northeast corner of the village.Elden Ring Map here",2,0
520,Exile Gauntlets,http://eldenring.wiki.fextralife.com/file/Elden-Ring/exile_gauntlets_elden_ring_wiki_guide_200px.png,Damaged iron gauntlets. Worn by soldiers sent to the penal colonies.,gauntlets,"[{'Phy': '2.9', 'VS Str': '2.1', 'VS Sla': '3.1', 'VS Pie': '2.9', 'Mag': '1.7', 'Fir': '2.5', 'Lit': '1.5', 'Hol': '2.1'}]","[{'Imm.': '8', 'Rob.': '17', 'Foc.': '6', 'Vit.': '4', 'Poi.': '4'}]",2.9,,Drop from Exile Soldiers.,6,0
521,Fingerprint Gauntlets,http://eldenring.wiki.fextralife.com/file/Elden-Ring/fingerprint_gauntlets_elden_ring_wiki_guide_200px.png,"Iron gauntlets singed and blistered by fingers. Worn by Vyke, knight of the Roundtable Hold. No other Tarnished was closer to the throne of the Elden Lord than Vyke. But without announcement, Vyke traveled far below the capital, and was scorched by the flame of frenzy. Did he make his choice for his maiden, or did some other force lure him with suggestion?",gauntlets,"[{'Phy': '3.3', 'VS Str': '2.9', 'VS Sla': '2.9', 'VS Pie': '2.9', 'Mag': '2.3', 'Fir': '3.1', 'Lit': '1.6', 'Hol': '2.3'}]","[{'Imm.': '11', 'Rob.': '20', 'Foc.': '4', 'Vit.': '8', 'Poi.': '5'}]",3.5,,Lord Contender's Evergaol: Dropped by Roundtable Knight Vyke upon defeat. Elden Ring Map here,8,0
522,Fire Monk Gauntlets,http://eldenring.wiki.fextralife.com/file/Elden-Ring/fire_monk_gauntlets_elden_ring_wiki_guide_200px.png,"Black iron gauntlets featuring a flame motif. Attire of the Fire Monks. The Fire Monks are guardians of the flame of ruin, forbidden by the Erdtree and said to be kept high in the Mountaintops of the Giants.",gauntlets,"[{'Phy': '3.5', 'VS Str': '3.1', 'VS Sla': '3.3', 'VS Pie': '3.1', 'Mag': '2.7', 'Fir': '3.3', 'Lit': '2.3', 'Hol': '2.3'}]","[{'Imm.': '11', 'Rob.': '18', 'Foc.': '8', 'Vit.': '8', 'Poi.': '5'}]",3.9,,"Dropped by Fire Monks found in camps in western Liurnia of the Lakes, around Fort Laiedd in Mt. Gelmir, and around Guardians' Garrison in the Mountaintop of the Giants.",6,0
523,Fire Prelate Gauntlets,http://eldenring.wiki.fextralife.com/file/Elden-Ring/fire_prelate_gauntlets_elden_ring_wiki_guide_200px.png,"Black iron gauntlets with the appearance of flames.Attire of the Fire Prelates, commanders of the Fire Monks.The weighty frames of the Prelates symbolized the onus of their grave vows as guardians of the flame. ""Etch this sight upon thine breast. Of my thunderous gravity.""",gauntlets,"[{'Phy': '4.9', 'VS Str': '4.3', 'VS Sla': '4.6', 'VS Pie': '4.6', 'Mag': '3.3', 'Fir': '5.0', 'Lit': '3.2', 'Hol': '3.3'}]","[{'Imm.': '22', 'Rob.': '21', 'Foc.': '30', 'Vit.': '17', 'Poi.': '10'}]",8.2,,Dropped by Fire Prelates.One can be found in Fort Laiedd in Mt. Gelmir.One is in Guardians' Garrison in Mountaintop of the Giants.,10,0
524,Foot Soldier Gauntlets,http://eldenring.wiki.fextralife.com/file/Elden-Ring/foot_soldier_gauntlets_elden_ring_wiki_guide_200px.png,Metal gauntlets covered in nicks and dents. Widely issued to foot soldiers in a lord's army.,gauntlets,"[{'Phy': '2.1', 'VS Str': '2.3', 'VS Sla': '2.1', 'VS Pie': '2.1', 'Mag': '2.5', 'Fir': '2.7', 'Lit': '2.8', 'Hol': '2.5'}]","[{'Imm.': '20', 'Rob.': '13', 'Foc.': '17', 'Vit.': '17', 'Poi.': '3'}]",2.6,,Dropped by Foot Soldier-type Soldier enemies. Defeat a Foot Soldier to gain a chance to obtain this item. Foot Soldiers can be found protecting the Purified Ruins.,5,0
525,Gauntlets,http://eldenring.wiki.fextralife.com/file/Elden-Ring/chain_gauntlets_elden_ring_wiki_guide_200px.png,"Gauntlets worn by ordinary soldiers.Though plain in appearance, they offer dependable protection.",gauntlets,"[{'Phy': '2.9', 'VS Str': '2.1', 'VS Sla': '3.2', 'VS Pie': '2.9', 'Mag': '1.7', 'Fir': '2.7', 'Lit': '1.5', 'Hol': '1.9'}]","[{'Imm.': '8', 'Rob.': '14', 'Foc.': '4', 'Vit.': '6', 'Poi.': '4'}]",2.9,,"Can be found at Church of Elleh, purchased from Merchant Kale. It costs 1000 Runes.Elden Ring Map here",6,0
526,Gelmir Knight Gauntlets,http://eldenring.wiki.fextralife.com/file/Elden-Ring/gelmir_knight_gauntlets_elden_ring_wiki_guide_200px.png,Gauntlets worn by knights once loyal to Praetor Rykard. Time has yet to dull their luster.,gauntlets,"[{'Phy': '3.3', 'VS Str': '2.8', 'VS Sla': '3.5', 'VS Pie': '3.3', 'Mag': '2.7', 'Fir': '3.1', 'Lit': '2.5', 'Hol': '2.7'}]","[{'Imm.': '12', 'Rob.': '18', 'Foc.': '8', 'Vit.': '8', 'Poi.': '5'}]",3.9,,You can loot the entire Gelmir Knight Set in the Gelmir Hero's Grave dungeon from a Gelmir Knight corpse.Elden Ring Map here.,7,0
527,Godrick Knight Gauntlets,http://eldenring.wiki.fextralife.com/file/Elden-Ring/godrick_knight_gauntlets_elden_ring_wiki_guide_200px.png,Gauntlets worn by knights loyal to Godrick the Grafted. Time has yet to dull their luster.,gauntlets,"[{'Phy': '3.3', 'VS Str': '2.9', 'VS Sla': '3.5', 'VS Pie': '3.2', 'Mag': '2.7', 'Fir': '2.9', 'Lit': '2.3', 'Hol': '2.7'}]","[{'Imm.': '12', 'Rob.': '19', 'Foc.': '8', 'Vit.': '8', 'Poi.': '5'}]",3.9,,Fort Haight.: Chance to drop from the Godrick Knight atop the fort walls.,6,0
528,Godrick Soldier Gauntlets,http://eldenring.wiki.fextralife.com/file/Elden-Ring/godrick_soldier_gauntlets_elden_ring_wiki_guide_200px.png,Gauntlets worn by soldiers loyal to Godrick the Grafted.Rust-worn and stained through unending conflict.,gauntlets,"[{'Phy': '3.2', 'VS Str': '2.8', 'VS Sla': '3.2', 'VS Pie': '3.1', 'Mag': '2.5', 'Fir': '2.7', 'Lit': '1.9', 'Hol': '2.3'}]","[{'Imm.': '11', 'Rob.': '18', 'Foc.': '8', 'Vit.': '8', 'Poi.': '5'}]",3.5,,"Gatefront Ruins, dropped by Godrick Soldiers patrolling the outpost.",6,0
529,Godskin Apostle Bracelets,http://eldenring.wiki.fextralife.com/file/Elden-Ring/godskin_apostle_bracelets_elden_ring_wiki_guide_200px.png,"Black bracelets of the Godskin Apostles.The apostles, once said to serve Destined Death, are wielders of the god-slaying black flame. But after their defeat by Maliketh, the Black Blade, the source of their power was sealed away.",gauntlets,"[{'Phy': '1.7', 'VS Str': '1.6', 'VS Sla': '1.6', 'VS Pie': '1.3', 'Mag': '3.2', 'Fir': '3.1', 'Lit': '3.2', 'Hol': '3.6'}]","[{'Imm.': '17', 'Rob.': '8', 'Foc.': '28', 'Vit.': '25', 'Poi.': '3'}]",2.1,,"Defeating Godskin Apostle, located at the bottom of Divine Tower of Caelid.Elden Ring Map here",3,0
530,Godskin Noble Bracelets,http://eldenring.wiki.fextralife.com/file/Elden-Ring/godskin_noble_bracelets_elden_ring_wiki_guide_200px.png,"Black bracelets of the Godskin Nobles. Nobles are the most ancient apostles who are said to have assimilated inhuman physiology. Not unlike the crucible, the Erdtree in its primordial form.",gauntlets,"[{'Phy': '1.3', 'VS Str': '2.1', 'VS Sla': '1.5', 'VS Pie': '1.3', 'Mag': '3.2', 'Fir': '2.9', 'Lit': '3.1', 'Hol': '3.4'}]","[{'Imm.': '14', 'Rob.': '8', 'Foc.': '24', 'Vit.': '25', 'Poi.': '3'}]",1.7,,Dropped by Godskin Noble Bossfight.Elden Ring Map here.,3,0
531,Gold Bracelets,http://eldenring.wiki.fextralife.com/file/Elden-Ring/gold_bracelets_elden_ring_wiki_guide_200px.png,Bracelets made in the image of Erdtree branches.Minimal adornments made by Lord Goldmask's disciples.Those disciples have long since left him.,gauntlets,"[{'Phy': '1.0', 'VS Str': '0.6', 'VS Sla': '0.6', 'VS Pie': '0.1', 'Mag': '2.9', 'Fir': '2.8', 'Lit': '2.9', 'Hol': '3.2'}]","[{'Imm.': '13', 'Rob.': '4', 'Foc.': '20', 'Vit.': '20', 'Poi.': '1'}]",0.8,,"Gold Bracelets can be found on Goldmask's body after the completion of Brother Corhyn's questline. Head south from the Capital of Ash site of grace and go down the small path in the direction of the colosseum. Go past the plant enemies and stick to the left and you will find Goldmask. Look the rune from him, and reset the area and return to find the rest of his set on his body.Elden Ring Map here",2,0
532,Golden Prosthetic,http://eldenring.wiki.fextralife.com/file/Elden-Ring/golden_prosthetic_elden_ring_wiki_guide_200px.png,Golden prosthetic forged using ancient techniques,gauntlets,"[{'Phy': '1.5', 'VS Str': '1.5', 'VS Sla': '1.5', 'VS Pie': '1.3', 'Mag': '3.2', 'Fir': '3.1', 'Lit': '3.2', 'Hol': '3.2'}]","[{'Imm.': '15', 'Rob.': '8', 'Foc.': '25', 'Vit.': '25', 'Poi.': '2'}]",2.8,,Currently Unobtainable.,0,0
533,Guardian Bracers,http://eldenring.wiki.fextralife.com/file/Elden-Ring/guardian_bracers_elden_ring_wiki_guide_200px.png,"Engraved golden bracers.Worn by the guardians of the Minor Erdtree.In accordance with an ancient pact with the Erdtree, it is said that their deaths led not to destruction, but instead to renewed, eternal life as guardians.",gauntlets,"[{'Phy': '2.7', 'VS Str': '2.5', 'VS Sla': '2.5', 'VS Pie': '2.3', 'Mag': '2.9', 'Fir': '2.8', 'Lit': '2.9', 'Hol': '2.9'}]","[{'Imm.': '25', 'Rob.': '17', 'Foc.': '20', 'Vit.': '19', 'Poi.': '3'}]",2.9,,"Guardian Set pieces can be acquired as drops from the Erdtree Guardians that are found near Minor Erdtrees in the Lands Between.An area dense with Guardians can be found by starting at the Dragonbarrow Fork site of grace, and working your way uphill towards the Minor Erdtree. Guardians are encountered in small groups and more come up from the ground, making it a good place to farm the set.",1,0
534,Haligtree Gauntlets,http://eldenring.wiki.fextralife.com/file/Elden-Ring/haligtree_gauntlets_elden_ring_wiki_guide_200px.png,Gauntlets worn by soldiers sworn to the Haligtree. Rust-worn and stained through unending conflict.,gauntlets,"[{'Phy': '3.2', 'VS Str': '2.9', 'VS Sla': '3.1', 'VS Pie': '3.2', 'Mag': '2.3', 'Fir': '2.5', 'Lit': '1.9', 'Hol': '2.5'}]","[{'Imm.': '11', 'Rob.': '18', 'Foc.': '8', 'Vit.': '8', 'Poi.': '4'}]",3.5,,"Haligtree Soldiers drop all pieces of the set. They are located throughout all areas of Elphael, Brace of the Haligtree.",6,0
535,Haligtree Knight Gauntlets,http://eldenring.wiki.fextralife.com/file/Elden-Ring/haligtree_knight_gauntlets_elden_ring_wiki_guide_200px.png,Gauntlets worn by knights sworn to the Haligtree.Time has yet to dull their luster.,gauntlets,"[{'Phy': '3.3', 'VS Str': '3.1', 'VS Sla': '3.3', 'VS Pie': '3.3', 'Mag': '2.5', 'Fir': '2.8', 'Lit': '2.3', 'Hol': '2.8'}]","[{'Imm.': '12', 'Rob.': '19', 'Foc.': '8', 'Vit.': '8', 'Poi.': '5'}]",3.9,,"Drops from Haligtree Knights, they can be found in the latter areas of Elphael, Brace of the Haligtree.",7,0
536,Highwayman Gauntlets,http://eldenring.wiki.fextralife.com/file/Elden-Ring/highwayman_gauntlets_elden_ring_wiki_guide_200px.png,Hideously stained and dented gauntlets.Worn by former foot soldiers who have turned to banditry.,gauntlets,"[{'Phy': '1.9', 'VS Str': '2.5', 'VS Sla': '1.9', 'VS Pie': '2.1', 'Mag': '2.7', 'Fir': '2.7', 'Lit': '2.8', 'Hol': '2.5'}]","[{'Imm.': '19', 'Rob.': '12', 'Foc.': '17', 'Vit.': '17', 'Poi.': '3'}]",2.6,,Dropped by the Bandits found in Murkwater Cave.,5,0
537,Hoslow's Gauntlets,http://eldenring.wiki.fextralife.com/file/Elden-Ring/hoslows_gauntlets_elden_ring_wiki_guide_200px.png,"Garish silver gauntlets decorated with red embellishments. Passed down through the Hoslow family.When Juno Hoslow received an invitation to the Volcano Manor, he discreetly refused.""I have already walked many a road drenched in blood, yet never would I consider myself a champion.""",gauntlets,"[{'Phy': '3.5', 'VS Str': '2.9', 'VS Sla': '3.3', 'VS Pie': '3.1', 'Mag': '2.7', 'Fir': '2.9', 'Lit': '2.5', 'Hol': '2.5'}]","[{'Imm.': '13', 'Rob.': '20', 'Foc.': '8', 'Vit.': '8', 'Poi.': '5'}]",3.9,,"All pieces of Hoslow's Set are dropped by Juno Hoslow along with Hoslow's Petal Whip as part of the final contract for the Volcano Manor questline.Juno Hoslow is a Hostile NPC that you can invade after progressing through the questline. His invade rune be found in the northern Mountaintops of the Giants, east of Shack of the Lofty.Elden Ring Map here",8,0
538,Iron Gauntlets,http://eldenring.wiki.fextralife.com/file/Elden-Ring/iron_gauntlets_elden_ring_wiki_guide_200px.png,Ordinary iron gauntlets.,gauntlets,"[{'Phy': '2.8', 'VS Str': '2.3', 'VS Sla': '2.9', 'VS Pie': '2.9', 'Mag': '2.1', 'Fir': '2.3', 'Lit': '1.5', 'Hol': '1.9'}]","[{'Imm.': '8', 'Rob.': '15', 'Foc.': '6', 'Vit.': '4', 'Poi.': '4'}]",2.9,,"Can be bought from the Nomadic Merchant at the eastern side of Weeping Peninsula, for 1500 Runes.Elden Ring Map here",6,0
539,Kaiden Gauntlets,http://eldenring.wiki.fextralife.com/file/Elden-Ring/kaiden_gauntlets_elden_ring_wiki_guide_200px.png,"Gauntlets worn by Kaiden sellswords. These hulking, fearless mercenaries, said to hail from the mountaintops of the wintry north, are adept at fighting on horseback. Kaiden is the name of their home settlement.",gauntlets,"[{'Phy': '2.9', 'VS Str': '2.1', 'VS Sla': '2.9', 'VS Pie': '2.9', 'Mag': '1.9', 'Fir': '2.1', 'Lit': '1.7', 'Hol': '1.9'}]","[{'Imm.': '8', 'Rob.': '15', 'Foc.': '6', 'Vit.': '6', 'Poi.': '4'}]",2.9,,Dropped by Northern Mercenaries and Mounted Northern Mercenaries found in Limgrave.,6,0
540,Knight Gauntlets,http://eldenring.wiki.fextralife.com/file/Elden-Ring/knight_gauntlets_elden_ring_wiki_guide_200px.png,"Iron gauntlets of an unknown knight. It is made of thin iron plate. Such metal armor is heavy, but provides considerable damage negation.",gauntlets,"[{'Phy': '3.1', 'VS Str': '2.9', 'VS Sla': '3.3', 'VS Pie': '3.3', 'Mag': '2.7', 'Fir': '2.7', 'Lit': '2.3', 'Hol': '2.1'}]","[{'Imm.': '9', 'Rob.': '17', 'Foc.': '6', 'Vit.': '6', 'Poi.': '5'}]",3.5,,"Can be purchased from Enia at the Roundtable Hold for 3,000 Runes.",7,0
541,Land of Reeds Gauntlets,http://eldenring.wiki.fextralife.com/file/Elden-Ring/land_of_reeds_gauntlets_elden_ring_wiki_guide_200px.png,Gauntlets wrapped in tough leather.Worn by the warriors of the Land of Reeds,gauntlets,"[{'Phy': '2.1', 'VS Str': '2.3', 'VS Sla': '2.9', 'VS Pie': '2.3', 'Mag': '2.5', 'Fir': '2.8', 'Lit': '2.9', 'Hol': '2.7'}]","[{'Imm.': '20', 'Rob.': '17', 'Foc.': '17', 'Vit.': '18', 'Poi.': '3'}]",2.8,,"Starting Equipment for the Samurai Class.Sold by the Isolated Merchant in Dragonbarrow for 1,000 Runes.Elden Ring Map here",6,0
542,Leather Gloves,http://eldenring.wiki.fextralife.com/file/Elden-Ring/leather_gloves_elden_ring_wiki_guide_200px.png,Lightweight and battle-proven leather gloves worn by a savvy soldier.Many admire the wearer of this armor for his chivalrous and forthright spirit.,gauntlets,"[{'Phy': '1.9', 'VS Str': '2.3', 'VS Sla': '1.9', 'VS Pie': '2.1', 'Mag': '2.3', 'Fir': '2.3', 'Lit': '2.5', 'Hol': '2.5'}]","[{'Imm.': '20', 'Rob.': '12', 'Foc.': '14', 'Vit.': '17', 'Poi.': '3'}]",2.4,,Murkwater Cave. Drops from Patches if he's killed after pleading for mercy. Elden Ring Map here,4,0
543,Leyndell Knight Gauntlets,http://eldenring.wiki.fextralife.com/file/Elden-Ring/leyndell_knight_gauntlets_elden_ring_wiki_guide_200px.png,Gauntlets worn by knights sworn to defend the royal capital of Leyndell. Time has yet to dull their luster,gauntlets,"[{'Phy': '3.3', 'VS Str': '3.1', 'VS Sla': '3.3', 'VS Pie': '3.3', 'Mag': '2.5', 'Fir': '2.8', 'Lit': '2.5', 'Hol': '2.7'}]","[{'Imm.': '12', 'Rob.': '19', 'Foc.': '8', 'Vit.': '8', 'Poi.': '5'}]",3.9,,"Dropped by Gold Dragon Cult Knights.Chance to drop from Leyndell Knights encountered in Leyndell, Royal Capital.",7,0
544,Leyndell Soldier Gauntlets,http://eldenring.wiki.fextralife.com/file/Elden-Ring/leyndell_soldier_gauntlets_elden_ring_wiki_guide_200px.png,Gauntlets worn by soldiers sworn to defend the royal capital of Leyndell.Rust-worn and stained through unending conflict.,gauntlets,"[{'Phy': '3.2', 'VS Str': '2.9', 'VS Sla': '3.1', 'VS Pie': '3.2', 'Mag': '2.3', 'Fir': '2.5', 'Lit': '2.1', 'Hol': '2.3'}]","[{'Imm.': '11', 'Rob.': '18', 'Foc.': '8', 'Vit.': '8', 'Poi.': '5'}]",3.5,,May drop from Knights in Leyndell Royal Capital.,6,0
545,Lionel's Gauntlets,http://eldenring.wiki.fextralife.com/file/Elden-Ring/lionels_gauntlets_elden_ring_wiki_guide_200px.png,"Founded iron gauntlets. Worn by Lionel the Lionhearted. When this chivalrous dauntless knight met Fia, who had been driven from her home, he declared himself to be her father.",gauntlets,"[{'Phy': '4.4', 'VS Str': '4.1', 'VS Sla': '4.9', 'VS Pie': '5.0', 'Mag': '3.3', 'Fir': '3.7', 'Lit': '3.2', 'Hol': '3.3'}]","[{'Imm.': '21', 'Rob.': '33', 'Foc.': '14', 'Vit.': '17', 'Poi.': '9'}]",7.1,,"Found on the bed in the building with the Lower Capital Church grace in Leyndell, Royal Capital.Elden Ring Map here",10,0
546,Lusat's Manchettes,http://eldenring.wiki.fextralife.com/file/Elden-Ring/lusats_manchettes_elden_ring_wiki_guide_200px.png,"Manchettes corroded by blue glintstones. Worn by Lusat, primeval current sorcerer.Lusat had reached a near-inorganic state.",gauntlets,"[{'Phy': '1.3', 'VS Str': '0.1', 'VS Sla': '1.3', 'VS Pie': '0.1', 'Mag': '3.4', 'Fir': '2.8', 'Lit': '3.1', 'Hol': '3.1'}]","[{'Imm.': '12', 'Rob.': '6', 'Foc.': '20', 'Vit.': '22', 'Poi.': '1'}]",1.1,,"All three armor pieces can be found after completing Sorceress Sellen's questline and siding with Sellen, return to Lusat's location in the Sellia Hideaway. The entire set will be on the ground where he used to occupy.Elden Ring Map here",2,0
547,Malenia's Gauntlet,http://eldenring.wiki.fextralife.com/file/Elden-Ring/malenias_gauntlet_elden_ring_wiki_guide_200px.png,"Gauntlet made of unalloyed gold. Worn by Malenia, Blade of Miquella. Malenia awaited Miquella at the foot of the husk. ""My brother will keep his promise. He possesses the wisdom, the allure, of a godhe is the most fearsome Empyrean of all.""",gauntlets,"[{'Phy': '3.1', 'VS Str': '2.3', 'VS Sla': '3.2', 'VS Pie': '2.8', 'Mag': '1.9', 'Fir': '2.3', 'Lit': '1.6', 'Hol': '2.7'}]","[{'Imm.': '17', 'Rob.': '14', 'Foc.': '6', 'Vit.': '6', 'Poi.': '4'}]",3.1,,"Purchased from Enia for 12,000 runes after defeating Malenia Blade of Miquella.",6,0
548,Malformed Dragon Gauntlets,http://eldenring.wiki.fextralife.com/file/Elden-Ring/malformed_dragon_gauntlets_elden_ring_wiki_guide_200px.png,"Malformed golden gauntlets.Adorned with various dragon imagery and worn by the misshapen Tree Sentinels.After the great ancient dragon Gransax attacked, the sentinels had an epiphany. The only way to truly protect the Erdtree was to become dragons themselves.",gauntlets,"[{'Phy': '4.2', 'VS Str': '3.7', 'VS Sla': '4.4', 'VS Pie': '4.2', 'Mag': '3.2', 'Fir': '3.2', 'Lit': '3.4', 'Hol': '3.2'}]","[{'Imm.': '19', 'Rob.': '25', 'Foc.': '13', 'Vit.': '13', 'Poi.': '7'}]",5.3,,Dropped by the Draconic Tree Sentinel in Crumbling Farum Azula.Elden Ring Map here,9,0
549,Maliketh's Gauntlets,http://eldenring.wiki.fextralife.com/file/Elden-Ring/malikeths_gauntlets_elden_ring_wiki_guide_200px.png,"Beast's gauntlets made of black iron and decorated with gold. Worn by Maliketh the Black Blade.Maliketh, Queen Marika's loyral half-brother, bore a blade imbued with Destined Death, and there was not one demigod who did not fear him. Champions knew what was at stake. Indeed, that is what made them champions",gauntlets,"[{'Phy': '3.3', 'VS Str': '2.9', 'VS Sla': '3.5', 'VS Pie': '3.3', 'Mag': '2.7', 'Fir': '2.8', 'Lit': '2.3', 'Hol': '3.2'}]","[{'Imm.': '12', 'Rob.': '19', 'Foc.': '8', 'Vit.': '17', 'Poi.': '5'}]",4.3,,"Bought from the Enia in the Roundtable Hold after defeating Maliketh, the Black Blade.",8,0
550,Mausoleum Gauntlets,http://eldenring.wiki.fextralife.com/file/Elden-Ring/mausoleum_gauntlets_elden_ring_wiki_guide_200px.png,Gauntlets worn by headless soldiers who endlessly guard the Wandering Mausoleum.Rust-worn and stained through unending conflict.,gauntlets,"[{'Phy': '3.2', 'VS Str': '2.7', 'VS Sla': '3.3', 'VS Pie': '3.1', 'Mag': '2.5', 'Fir': '2.5', 'Lit': '2.1', 'Hol': '2.5'}]","[{'Imm.': '11', 'Rob.': '17', 'Foc.': '8', 'Vit.': '7', 'Poi.': '5'}]",3.5,,Mausoleum Soldier Set pieces drop from Mausoleum Soldiers. They can be found patrolling areas around some of the Wandering Mausoleums.An easy spot to farm this set is east of the East Gate Bridge Trestle site of grace in Liurnia of the Lakes. Several groups of 3 or 4 Mausoleum Soldiers are patrolling around this Wandering Mausoleum.,6,0
551,Mausoleum Knight Gauntlets,http://eldenring.wiki.fextralife.com/file/Elden-Ring/mausoleum_knight_gauntlets_elden_ring_wiki_guide_200px.png,Gauntlets worn by headless knights who endlessly guard the Walking Mausoleum.Time has yet to dull their luster.,gauntlets,"[{'Phy': '3.3', 'VS Str': '2.8', 'VS Sla': '3.6', 'VS Pie': '3.2', 'Mag': '2.7', 'Fir': '2.8', 'Lit': '2.5', 'Hol': '2.8'}]","[{'Imm.': '12', 'Rob.': '18', 'Foc.': '8', 'Vit.': '8', 'Poi.': '5'}]",3.9,,"Mausoleum Knight Set pieces are dropped by Mausoleum Knights, typically found in Liurnia of the Lakes. The easiest one to farm is directly outside the Black Knife Catacombs entrance, which can be reset quickly with the site of grace.",7,0
552,Millicent's Gloves,http://eldenring.wiki.fextralife.com/file/Elden-Ring/millicents_gloves_elden_ring_wiki_guide_200px.png,Gloves worn by Millicent the Rotting,gauntlets,"[{'Phy': '1.0', 'VS Str': '1.0', 'VS Sla': '1.0', 'VS Pie': '0.6', 'Mag': '3.1', 'Fir': '2.9', 'Lit': '3.1', 'Hol': '3.1'}]","[{'Imm.': '13', 'Rob.': '7', 'Foc.': '21', 'Vit.': '21', 'Poi.': '1'}]",1.1,,The Millicent's Gloves Armor Gauntlets piece is not currently obtainable.,0,0
553,Mushroom Arms,http://eldenring.wiki.fextralife.com/file/Elden-Ring/mushroom_arms_elden_ring_wiki_guide_200px.png,"Mushrooms found growing all over the body. These overgrown mushroom have colonized the arms. To those enraptured by the scarlet rot, they are holy vestments that root one to the earth.",gauntlets,"[{'Phy': '1.5', 'VS Str': '1.7', 'VS Sla': '0.6', 'VS Pie': '1.3', 'Mag': '3.3', 'Fir': '1.3', 'Lit': '3.2', 'Hol': '3.2'}]","[{'Imm.': '34', 'Rob.': '8', 'Foc.': '30', 'Vit.': '25', 'Poi.': '1'}]",1.7,,Found in a cavern in Seethewater Cave filled with mushroom people and a Giant Poison Flower.Elden Ring Interactive Map Link,1,0
