id,weapon_id,name,image,weight,description,dlc,requirements,damage type,category,passive effect,skill,FP cost
280,281,Vyke's War Spear,http://eldenring.wiki.fextralife.com/file/Elden-Ring/vykes_war_spear_greatspear_weapon_elden_ring_wiki_guide_200px.png,8,"War spear singed and blistered by fingers, used by Vyke, Knight of the Roundtable Hold. Like Vyke himself, it has been tormented by the yellow flame of frenzy from within.",0,"{'Str': 16, 'Dex': 20, 'Fai': 18}",Pierce,Great Spears,(65) Madness,Frenzyflame Thrust,22
281,282,Mohgwyn's Sacred Spear,http://eldenring.wiki.fextralife.com/file/Elden-Ring/mohgwyns_sacred_spear_great_spears_elden_ring_wiki_guide_200px.png,10.0,"Trident of Mohg, Lord of Blood. A sacred spear that will come to symbolize his dynasty. As well as serving as a weapon, it is an instrument of communion with an outer god who bestows power upon accursed blood. The mother of truth desires a wound.",0,"{'Str': 24, 'Dex': 14, 'Arc': 27}",Pierce,Great Spears,(55) Hemorrhage,Bloodboon Ritual,20 (-20)
282,283,Bloodfiend's Sacred Spear,http://eldenring.wiki.fextralife.com/file/Elden-Ring/bloodfiends_sacred_spear_elden_ring_shadow_of_the_erdtree_dlc_wiki_guide_200px.png,8.0,Greatspear of the bloodfiend hexers. One of the most significant implements used in their blood rituals. Sacred spears of blood are the instruments of communion with an outer god. The mother of truth desires a wound.,1,"{'Str': 22, 'Dex': 12, 'Arc': 13}",Standard/Pierce,Great Spears,(55) Hemorrhage,Bloodfiend's Bloodboon,20
283,284,Messmer Soldier's Spear,http://eldenring.wiki.fextralife.com/file/Elden-Ring/messmer_soldiers_spear_spears_elden_ring_shadow_of_the_erdtree_dlc_wiki_guide_200px.png,8.5,"Weapon used by the soldiers who serve Messmer the Impaler. A greatspear with a steel blade worn from use. Being made for overwhelming onslaughts, attacks with this weapon can be charged to unleash consecutive strikes.",1,"{'Str': 19, 'Dex': 16}",Standard/Pierce,Great Spears,No passive effects,Impaling Thrust,9
284,285,Spear of the Impaler,http://eldenring.wiki.fextralife.com/file/Elden-Ring/spear_of_the_impaler_elden_ring_shadow_of_the_erdtree_dlc_wiki_guide_200px.png,9.5,"Weapon of Messmer the Impaler. A greatspear with a warped blade in the shape of undulating flame. Remade by the forging arts of the realm of shadow, this weapon can be thrown by executing a strong attack, dashing strong attack, or mounted strong attack. Charge the attack to produce flame on impact.",1,"{'Str': 14, 'Dex': 35, 'Fai': 18}",Standard/Pierce,Great Spears,No passive effects,Messmer's Assault,15
285,286,Barbed Staff-Spear,http://eldenring.wiki.fextralife.com/file/Elden-Ring/barbed_staff-spear_spears_elden_ring_shadow_of_the_erdtree_dlc_wiki_guide_200px.png,7.5,"Greatstaff of Jori, elder inquisitor. The tip bristles with golden barbs symbolic of the inquisition's torture, allowing one to wield the staff as a greatspear. Attacks deal holy damage, and potency increases with faith.",1,"{'Str': 14, 'Dex': 18, 'Fai': 22}",Standard/Pierce,Great Spears,(55) Hemorrhage,Jori's Inquisition,4
286,287,Halberd,http://eldenring.wiki.fextralife.com/file/Elden-Ring/halberd_halberd_weapon_elden_ring_wiki_guide_200px.png,8.0,"A long-handled polearm that combines the functions of both axe and spear. Can be used to press a single enemy with continuous thrusting attacks or swept at groups, taking advantage of its great reach and cleaving blade. A versatile weapon for any situation.",0,"{'Str': 14, 'Dex': 12}",Standard/Pierce,Halberds,No passive effects,Charge Forth,16
287,288,Banished Knight's Halberd,http://eldenring.wiki.fextralife.com/file/Elden-Ring/banished_knights_halberd_halberd_weapon_elden_ring_wiki_guide_200px.png,8,"A finely-crafted halberd intricately engraved with an ancient motif. Given to knights who, whether by misfortune or misdeed, were forced to abandon their homes. Most of these knights were sent to the fringes, where they were forced to start anew with only despair for company.",0,"{'Str': 14, 'Dex': 12}",Standard/Pierce,Halberds,No passive effects,Charge Forth,16
288,289,Lucerne,http://eldenring.wiki.fextralife.com/file/Elden-Ring/lucerne_halberd_weapon_elden_ring_wiki_guide_200px.png,7.0,"This polearm features a hard, sharpened beak-like spike attached to its head, designed to pierce armor. Though designed mainly as a thrusting weapon, its long handle can be utilized to get around an enemy's guard with a sideward sweeping attack.",0,"{'Str': 15, 'Dex': 12}",Pierce,Halberds,No passive effects,Charge Forth,16
289,290,Glaive,http://eldenring.wiki.fextralife.com/file/Elden-Ring/glaive_halberds_elden_ring_wiki_guide_200px.png,10,Weapon comprised of a sharp blade affixed to a long grip. It is in fact a sickle repurposed to be a tool of war. This far-reaching weapon excels at slashing attacks.,0,"{'Str': 18, 'Dex': 15}",Slash/Pierce,Halberds,No passive effects,Spinning Slash,6
290,291,Vulgar Militia Shotel,http://eldenring.wiki.fextralife.com/file/Elden-Ring/vulgar_militia_shotel_halberd_weapon_elden_ring_wiki_guide_200px.png,8.0,"A hooked blade attached to a long handle. Wielded by the vulgar militia, its attacks can slip through an enemy's guard. The vulgar militia are the undecorated stewards of rancid, scorched battlefields that none dare approach, and forbidden domains better forgotten by the rest of the world",0,"{'Str': 14, 'Dex': 16}",Standard/Pierce,Halberds,No passive effects,Spinning Slash,6( - 12)
291,292,Vulgar Militia Saw,http://eldenring.wiki.fextralife.com/file/Elden-Ring/vulgar_militia_saw_halberd_weapon_elden_ring_wiki_guide_200px.png,8.0,"A weapon comprised of a saw blade attached to a long grip. Brandished by the vulgar militia, its serrated edge is very effective at inflicting blood loss. The saw is said to also be used to cut up bodies to feed the militia, but there are no firsthand witnesses to confirm the dire rumor.",0,"{'Str': 15, 'Dex': 13}",Standard/Pierce,Halberds,(55) Hemorrhage,Spinning Slash,6
292,293,Guardian's Swordspear,http://eldenring.wiki.fextralife.com/file/Elden-Ring/guardians_swordspear_halberd_weapon_elden_ring_wiki_guide_200px.png,9,"Weapon comprising a long handle and broad blade sharpened from the hard wood of old trees. Wielded by guardians of the Minor Erdtrees, known as experts in the arts of combat. The power of this weapon scales greatly with dexterity.",0,"{'Str': 17, 'Dex': 16}",Standard/Pierce,Halberds,No passive effects,Spinning Slash,6 ( -12)
293,294,Gargoyle's Halberd,http://eldenring.wiki.fextralife.com/file/Elden-Ring/gargoyles_halberd_halberd_weapon_elden_ring_wiki_guide_200px.png,12.0,"Bronze halberd wielded by Valiant Gargoyles. Just like the wielder, the missing parts have been mended with corpse wax; a patchwork of champions.",0,"{'Str': 26, 'Dex': 10}",Standard/Pierce,Halberds,No passive effects,Spinning Slash,6 ( - 12)
294,295,Gargoyle's Black Halberd,http://eldenring.wiki.fextralife.com/file/Elden-Ring/gargoyles_black_halberd_halberd_weapon_elden_ring_wiki_guide_200px.png,12.0,"Bronze halberd wielded by Valiant Gargoyles, mended with blackened corpse wax. Deals holy damage. Such is the mark of those who serve Maliketh, the Black Blade.",0,"{'Str': 26, 'Dex': 10, 'Fai': 22}",Standard/Pierce,Halberds,No passive effects,Spinning Slash,6 ( -12)
295,296,Nightrider Glaive,http://eldenring.wiki.fextralife.com/file/Elden-Ring/nightrider_glaive_halberd_weapon_elden_ring_wiki_guide_200px.png,12.0,"A jet-black glaive with a blade as weighty as a bludgeon. Weapon of the Night's Cavalry who ride funeral steeds. This glaive excels at weighty slash attacks that crash into foes, making it a powerful weapon even on horse back.",0,"{'Str': 26, 'Dex': 10}",Slash/Pierce,Halberds,No passive effects,Spinning Slash,6 ( - 12)
296,297,Pest's Glaive,http://eldenring.wiki.fextralife.com/file/Elden-Ring/pests_glaive_halberd_weapon_elden_ring_wiki_guide_200px.png,7,"Glaive made from a hard, sharpened shell. Wielded by the pests who emerged from the Swamp of Aeonia. Slightly increases non-physical damage negation. Though men might recognize the keen intellect of the pests evidenced by this spear's uncanny design, it will never be understood by them.",0,"{'Str': 13, 'Dex': 13}",Slash/Pierce,Halberds,No passive effects,Spinning Slash,6( - 12)
297,298,Ripple Crescent Halberd,http://eldenring.wiki.fextralife.com/file/Elden-Ring/ripple_crescent_halberd_halberd_weapon_elden_ring_wiki_guide_200px.png,8.5,"Weapon wielded by young Albinaurics. The blade is said to resemble a partial image of a ripple, and its attack power scales with one's arcane attribute.",0,"{'Str': 12, 'Dex': 12, 'Arc': 20}",Standard/Pierce,Halberds,No passive effects,Spinning Slash,6( - 12)
298,299,Golden Halberd,http://eldenring.wiki.fextralife.com/file/Elden-Ring/golden_halberd_halberd_weapon_elden_ring_wiki_guide_200px.png,13.5,"Weighty halberd forged of gold. Wielded by the Order of Tree Sentinels, heavily equipped knights. Deals holy damage. A masterfully crafted weapon that lives up to its heft, but is difficult for one mere human strength to wield.",0,"{'Str': 30, 'Dex': 14, 'Fai': 12}",Standard/Pierce,Halberds,No passive effects,Golden Vow,40
299,300,Dragon Halberd,http://eldenring.wiki.fextralife.com/file/Elden-Ring/dragon_halberd_halberd_weapon_elden_ring_wiki_guide_200px.png,10.5,"Halberd shaped like a dragon, enwreathed with both ice and lightning. Alas, the Dragonkin Soldiers never attained immortality, and perished as decrepit, pale imitations of their skyborn kin.",0,"{'Str': 22, 'Dex': 10}",Standard/Pierce,Halberds,No passive effects,Spinning Slash,17 ( - 11)
300,301,Loretta's War Sickle,http://eldenring.wiki.fextralife.com/file/Elden-Ring/lorettas_war_sickle_halberd_weapon_elden_ring_wiki_guide_200px.png,10,"Intricately crafted silver war sickle wielded by Loretta, Knight of the Haligtree. Originally given for service as a personal guard to Carian royalty, the weapon's blue glintstone has been replaced with unalloyed gold.",0,"{'Str': 20, 'Dex': 15, 'Int': 20}",Slash/Pierce,Halberds,No passive effects,Loretta's Slash,14
301,302,Commander's Standard,http://eldenring.wiki.fextralife.com/file/Elden-Ring/commanders_standard_halberd_weapon_elden_ring_wiki_guide_200px.png,11.5,"A beaten red battle standard is furled around this time-worn halberd. Even after his lord was fled, Commander O'Neil continued to brandish this flag in the devastation of the rot-eaten field of battle, the sole veteran who remembers this battle with pride.",0,"{'Str': 24, 'Dex': 14}",Standard/Pierce,Halberds,No passive effects,Rallying Standard,30
302,303,Spirit Glaive,http://eldenring.wiki.fextralife.com/file/Elden-Ring/spirit_glaive_elden_ring_shadow_of_the_erdtree_dlc_wiki_guide_200px.png,6.5,Sharp blade sculpted into a twisted shape. A glaive that has seen many years of use in the gravesite. Said to serve as a medium for communion with spirits.,1,"{'Str': 14, 'Dex': 17, 'Int': 16}",Slash/Pierce,Halberds,No passive effects,Rancor Slash,12
303,304,Poleblade of the Bud,http://eldenring.wiki.fextralife.com/file/Elden-Ring/poleblade_of_the_bud_elden_ring_shadow_of_the_erdtree_dlc_wiki_guide_200px.png,10.0,"Weapon of Romina, Saint of the Bud. A scarlet glaive with a dangling bud-like blade. Attacks cause buildup of rot. Once, in the crumbling, burning church, Romina held the bud in speechless silence. That bud would become her blade.",1,"{'Str': 14, 'Dex': 22, 'Arc': 20}",Slash/Pierce,Halberds,(55) Scarlet Rot,Romina's Purification,24
304,305,Scythe,http://eldenring.wiki.fextralife.com/file/Elden-Ring/scythe_reaper_weapon_elden_ring_wiki_guide_200px.png,7.5,"Large scythe featuring a long, slender blade. Designed to reap, this weapon is capable of rapidly inflicting blood loss while also slipping through an enemy's guard. In the hands of a highly dexterous wielder it is capable of striking fear into the heart of any foe.",0,"{'Str': 14, 'Dex': 14}",Slash,Reapers,(55) Hemorrhage,Spinning Slash,6 ( - 12)
305,306,Grave Scythe,http://eldenring.wiki.fextralife.com/file/Elden-Ring/grave_scythe_reaper_weapon_elden_ring_wiki_guide_200px.png,9.5,Greatscythe comprised of a large blade affixed to a crooked stick. Weapon wielded by the aged grave keepers who tend the forgotten graveyards throughout the Lands Between. This weapon is said to have served as a charm against evil spirits in times of old.,0,{'Str': 17},Slash,Reapers,(55) Hemorrhage,Spinning Slash,6
306,307,Halo Scythe,http://eldenring.wiki.fextralife.com/file/Elden-Ring/halo_scythe_reaper_weapon_elden_ring_wiki_guide_200px.png,8.5,"War scythe of the Cleanrot Knights who fought alongside Malenia, Blade of Miquella. This was the weapon of commanders in Malenia's army, and the half-halo blade deals holy damage.",0,"{'Str': 13, 'Dex': 16, 'Fai': 15}",Slash,Reapers,(55) Hemorrhage,Miquella's Ring of Light,11
307,308,Winged Scythe,http://eldenring.wiki.fextralife.com/file/Elden-Ring/winged_scythe_reaper_weapon_elden_ring_wiki_guide_200px.png,7.5,"Sacred scythe resembling a pair of white wings. Deals holy damage. According to pagan belief, white-winged maidens are said to be Death's gentle envoys.",0,"{'Str': 16, 'Dex': 16, 'Fai': 24}",Slash,Reapers,(55) Hemorrhage,Angel's Wings,17
308,309,Obsidian Lamina,http://eldenring.wiki.fextralife.com/file/Elden-Ring/obsidian_lamina_reaper_elden_ring_shadow_of_the_erdtree_dlc_wiki_guide_200px.png,6.5,"Signature weapon of the Pureblood Knight Ansbach. A viciously keen and slender scythe made for combat. The obsidian edge relies not upon trickery to fulfil its violent purposethrough skill alone the wielder can rip and rend through foes, sowing blossoms of red upon the battlefield.",1,"{'Str': 12, 'Dex': 25, 'Arc': 17}",Slash,Reapers,(33) Hemorrhage,Dynastic Sickleplay,5
309,310,Whip,http://eldenring.wiki.fextralife.com/file/Elden-Ring/whip_weapon_elden_ring_wiki_guide_200px.png,2.0,"A leather whip. Not originally used for combat, but as an instrument of pain. Through its supple attacks cannot be thwarted by parrying or even guarding, it is incapable of dealing critical hits.",0,"{'Str': 8, 'Dex': 14}",Strike,Whips,No passive effects,Kick,0
310,311,Thorned Whip,http://eldenring.wiki.fextralife.com/file/Elden-Ring/thorned_whip_weapon_elden_ring_wiki_guide_200px.png,2.5,"Hefty whip coverd in crimson thorns. Weapon of the Prelates who lead the Fire Monks. A device of fearsome religious encouragement, it is fashioned in the image of the briars of sin. Very effective at inflicting blood loss.",0,"{'Str': 8, 'Dex': 16}",Strike,Whips,(50) Hemorrhage,Kick,0
311,312,Urumi,http://eldenring.wiki.fextralife.com/file/Elden-Ring/urumi_weapon_elden_ring_wiki_guide_200px.png,3.0,"This weapon made of extremely thin, flexible blades of metal is wielded like a whip by Nightfolk warriors. Though in essence a whip with a cutting edge, it can also be used as a spear to pierce foes.",0,"{'Str': 10, 'Dex': 19}",Slash,Whips,No passive effects,Kick,0
312,313,Hoslow's Petal Whip,http://eldenring.wiki.fextralife.com/file/Elden-Ring/hoslows_petal_whip_weapon_elden_ring_wiki_guide_200px.png,3.5,"Metal whip formed of razor-sharp chain-link blades that have theappearance of flower petals. This work of art is handed downthough the generations of the illustrious House Hoslow.High dexterity is required to wield this weapon, but it excels at inflicting devastation",0,"{'Str': 10, 'Dex': 20}",Strike,Whips,(55) Hemorrhage,Kick,0
313,314,Magma Whip Candlestick,http://eldenring.wiki.fextralife.com/file/Elden-Ring/magma_whip_candlestick_weapon_elden_ring_wiki_guide_200px.png,2.5,"This ritual implement is a three pronged candlestick with solidflames formed of the magma of Mt. Gelmir. When wielded as a weapon, the flames become supple whips oflava.",0,"{'Str': 8, 'Dex': 16, 'Fai': 18}",Strike,Whips,No passive effects,Sea of Magma,5 ( -5)
314,315,Giant's Red Braid,http://eldenring.wiki.fextralife.com/file/Elden-Ring/giant's_red_braid_weapon_elden_ring_wiki_guide_200px.png,2.5,"Hefty whip woven from the flame-red hair of a Fire Giant. Every giant is red of hair, and Radagon was said to have despised his own red locks. Perhaps that was a curse of their kind.",0,"{'Str': 18, 'Dex': 12, 'Fai': 21}",Strike,Whips,No passive effects,Flame Dance,25
315,316,Tooth Whip,http://eldenring.wiki.fextralife.com/file/Elden-Ring/tooth_whip_whips_elden_ring_shadow_of_the_erdtree_dlc_wiki_guide_200px.png,3.0,"Whip bestrewn with rotting, misshapen teeth. Filthy and seething with disease, the teeth are embedded in the whip and dose the victim with deadly poison upon each strike. As the wounds ripen they grow inflamed and ooze pus. The flesh of shamans was said to meld harmoniously with others.",1,"{'Str': 10, 'Dex': 24}",Strike,Whips,(66) Poison,Painful Strike,16
316,317,Caestus,http://eldenring.wiki.fextralife.com/file/Elden-Ring/caestus_fist_weapon_elden_ring_wiki_guide_200px.png,1.5,"A weapon built for striking with the fists, made of tough leather inlaid with iron rivets. Fist weapons come in pairs, and two-handing this weapon will equip it to both hands.",0,"{'Str': 8, 'Dex': 8}",Strike,Fists,No passive effects,Endure,9
317,318,Spiked Caestus,http://eldenring.wiki.fextralife.com/file/Elden-Ring/spiked_caestus_fist_weapon_elden_ring_wiki_guide_200px.png,2,"A Caestus with the rivets replaced by blood loss-inducing spikes. Fists weapons come in pairs, and two-handing this weapon will equip it to both hands.",0,"{'Str': 8, 'Dex': 10}",Strike,Fists,(45) Hemorrhage,Endure,9
318,319,Katar,http://eldenring.wiki.fextralife.com/file/Elden-Ring/katar_fist_weapon_elden_ring_wiki_guide_200px.png,2.5,Imported dagger design with a rather unique handle. The blade can be swung about as the extension of one's fist.,0,"{'Str': 8, 'Dex': 10}",Slash/Pierce,Fists,No passive effects,Impaling Thrust,14
319,320,Iron Ball,http://eldenring.wiki.fextralife.com/file/Elden-Ring/iron_ball_fist_weapon_elden_ring_wiki_guide_200px.png,2.5,"Iron manifer of spherical shape. Big Boggart the blackguard's weapon of choice. Not a weapon to be taken lightly, as its weighty blows shatter bones with ease.",0,"{'Str': 11, 'Dex': 8}",Strike,Fists,No passive effects,Endure,9
320,321,Star Fist,http://eldenring.wiki.fextralife.com/file/Elden-Ring/star_fist_fist_weapon_elden_ring_wiki_guide_200px.png,3,Spherical iron manifer covered in spikes which induce blood loss. Used in brutal games of pugilism.,0,"{'Str': 12, 'Dex': 8}",Strike,Fists,(45) Hemorrhage,Endure,9
321,322,Clinging Bone,http://eldenring.wiki.fextralife.com/file/Elden-Ring/clinging_bone_fist_weapon_elden_ring_wiki_guide_200px.png,3,"Horrific weapon made of a hardened skeletal arm. Wielded by Ensha of the Royal Remains. Fitted by placing one's hands into the fists' grips until they dig in. """"O clinging creature. A king relinquishes not the hand.""""",0,"{'Str': 8, 'Dex': 22, 'Arc': 16}",Slash/Pierce,Fists,No passive effects,Lifesteal Fist,14
322,323,Veteran's Prosthesis,http://eldenring.wiki.fextralife.com/file/Elden-Ring/veterans_prosthesis_fist_weapon_elden_ring_wiki_guide_200px.png,4,"Bladed prosthetic leg enwreathed with the power of lightning, instead attached to the fist. Commander Niall, veteran of Castle Sol, offered this prosthesis in exchange for the lives of defeated knights held prisoner. He went on to lead these men as an army of no nation.",0,"{'Str': 15, 'Dex': 12}",Slash/Pierce,Fists,No passive effects,Storm Kick,10
323,324,Cipher Pata,http://eldenring.wiki.fextralife.com/file/Elden-Ring/cipher_pata_fist_weapon_elden_ring_wiki_guide_200px.png,0,"One of the weapons originating from the Two Fingers. A formless sequence of ciphers comprise its blade, and as such no shield can repel it. Deals holy damage. The furtive inscription appears to hang in the air; the language of light spoken by the Two Fingers.",0,{'Fai': 30},Slash/Pierce,Fists,No passive effects,Unblockable Blade,17
324,325,Grafted Dragon,http://eldenring.wiki.fextralife.com/file/Elden-Ring/grafted_dragon_fist_weapon_elden_ring_wiki_guide_200px.png,2.5,"The embodiment of the power that still remained in the dragon's head that was grafted to Godrick's left arm. The wielder's arm will take the form of a small dragon, sprouting sharp dragon fangs at the fist.This weapon cannot be two-handed.",0,"{'Str': 20, 'Dex': 14, 'Fai': 16}",Strike,Fists,No passive effects,Bear Witness!,20
325,326,Pata,http://eldenring.wiki.fextralife.com/file/Elden-Ring/pata_elden_ring_shadow_of_the_erdtree_dlc_wiki_guide_200px.png,4.0,"A weapon comprised of a linear, double-sided blade attached to a substantial guard. Wielded by the Oathseeker Knights. This versatile armament can be swung about like a fist or used in the manner of a straight sword.",1,"{'Str': 11, 'Dex': 15}",Standard/Pierce,Fists,No passive effects,Impaling Thrust,9
326,327,Golem Fist,http://eldenring.wiki.fextralife.com/file/Elden-Ring/golem_fist_fist_elden_ring_shadow_of_the_erdtree_dlc_wiki_guide_200px.png,5.0,A giant fist of fractured rock. Taken from the body of a golem of the ruined forges. Carved with a smithscript enabling strong attacks to launch the entire fist straight ahead.,1,"{'Str': 24, 'Dex': 8, 'Int': 11, 'Fai': 11}",Strike,Fists,No passive effects,Endure,9
327,328,Madding Hand,http://eldenring.wiki.fextralife.com/file/Elden-Ring/madding_hand_elden_ring_shadow_of_the_erdtree_dlc_wiki_guide_200px.png,1.0,"A glove stitched together from the flayed skin of the victims of a butcherous bloodbath. Afflicts target with madness. Raises attack power when madness is triggered in the vicinity. Forged of an unyielding, black impulse toward revenge fostered in those who were hunted down as heretics by their own brethren, these are the weapons of the utterly downtrodden.",1,"{'Str': 8, 'Dex': 8, 'Int': 13, 'Fai': 20}",Strike,Fists,(55) Madness,Madding Spear-Hand Strike,13
328,329,Thiollier's Hidden Needle,http://eldenring.wiki.fextralife.com/file/Elden-Ring/thiolliers_hidden_needle_elden_ring_shadow_of_the_erdtree_dlc_wiki_guide_200px.png,0.5,"Concealed weapon used by Thiollier, of a design generally favored by poison-wielders for dark and subtle purposes. Like St. Trina, who blossomed in the deep-purple garden, a rich poison is secreted from within which sends its victims into an eternal sleep.",1,"{'Str': 10, 'Dex': 22, 'Int': 15}",Pierce,Fists,(42) Sleep,Sleep Evermore,16
329,330,Poisoned Hand,http://eldenring.wiki.fextralife.com/file/Elden-Ring/poisoned_hand_elden_ring_shadow_of_the_erdtree_dlc_wiki_guide_200px.png,1.0,"A glove stitched together from the flayed skin of the victims of a butcherous bloodbath. Afflicts target with deadly poison. Raises attack power when poisoning occurs in the vicinity. Forged of an unyielding, black impulse toward revenge fostered in those who have had everything burned or stolen from them, these are the weapons of the utterly downtrodden.",1,"{'Str': 8, 'Dex': 8, 'Arc': 28}",Strike,Fists,(36) Poison,Poison Spear-Hand Strike,13
330,331,Hookclaws,http://eldenring.wiki.fextralife.com/file/Elden-Ring/hookclaws_claw_weapon_elden_ring_wiki_guide_200px.png,2.0,"Weapon worn on the fist comprised of sharp parallel blades favored by those who lurk in the dark. Lacerations cause blood loss with great effect. Claw weapons come in pairs, and two-handing this weapon will equip it to both hands.",0,"{'Str': 8, 'Dex': 14}",Slash/Pierce,Claws,(60) Hemorrhage,Quickstep,3
331,332,Bloodhound Claws,http://eldenring.wiki.fextralife.com/file/Elden-Ring/bloodhound_claws_claw_weapon_elden_ring_wiki_guide_200px.png,3.0,Large curved claws used by Bloodhound Knights. The curve allows the weapon to slip through an enemy's guard.,0,"{'Str': 10, 'Dex': 15}",Slash/Pierce,Claws,(60) Hemorrhage,Bloodhound's Step,5
332,333,Venomous Fang,http://eldenring.wiki.fextralife.com/file/Elden-Ring/venomous_fang_claw_weapon_elden_ring_wiki_guide_200px.png,2.5,One of the weapons designed for gladiatorial combat. Used by duelists who were exiled from the colosseum. The black fang protruding from the bronze snake head is coated in deadly poison.,0,"{'Str': 9, 'Dex': 9}",Slash/Pierce,Claws,(72) Poison,Quickstep,3
333,334,Raptor Talons,http://eldenring.wiki.fextralife.com/file/Elden-Ring/raptor_talons_claw_weapon_elden_ring_wiki_guide_200px.png,1.5,"Claw comprised of two sharp, thin blades, wielded by the assassins of Ravenmount, this weapon allows them to imitate the attacks of Deathbirds. Besides excelling at airborne attacks, its charge attack mimics the vicious swoop of a bird of prey.",0,"{'Str': 6, 'Dex': 14}",Slash/Pierce,Claws,(60) Hemorrhage,Quickstep,3
334,335,Claws of Night,http://eldenring.wiki.fextralife.com/file/Elden-Ring/claws_of_night_unique_elden_ring_shadow_of_the_erdtree_dlc_wiki_guide_200px.png,3.0,"Claws of a bottomless black from which no light can escape. Wielded by Anna, Swordhand of Night. Engraved with a smithscript enabling strong attack to launch all three claws at a target. The blades are only semicorporeal, and cannot be fully guarded against.",1,"{'Str': 8, 'Dex': 20}",Slash/Pierce,Claws,(45) Hemorrhage,Scattershot Throw,11
335,336,Shortbow,http://eldenring.wiki.fextralife.com/file/Elden-Ring/shortbow_lightbow_weapon_elden_ring_wiki_guide_200px.png,2.5,"Small bow made to fire arrows over great distances. Other than its ability to fire off arrows in rapid succession, it is also well-suited for use on horseback. To use a bow, arrows must also be equipped.",0,"{'Str': 8, 'Dex': 10}",None,Light Bows,No passive effects,Barrage,- ( 2 2)
336,337,Composite Bow,http://eldenring.wiki.fextralife.com/file/Elden-Ring/composite_bow_light_bow_weapon_elden_ring_wiki_guide_200px.png,3.0,"Bow composited from a mix of Materials. Demands high attributes, and is tricky to wield, but is a fearsome tool when mastered.",0,"{'Str': 15, 'Dex': 15}",None,Light Bows,No passive effects,Mighty Shot,-( 6 6)
